numconnections,seniority,currentindustry,mapped_role,total_experience_years,highest_degree,company_cleaned,campus_cleaned,cluster_id
282,3.0,Recreational Facilities,accounting finance,29.17,MBA,the juilliard school,st john s university the peter j tobin college of business,2
268,2.0,Hospital & Health Care,teaching,9.42,Doctor,icahn school of medicine at mount sinai,university of illinois at chicago,2
246,3.0,Software Development,software engineer,1.59,Bachelor,google,duke university,2
372,1.0,Museums & Institutions,stage,6.49,Bachelor,the museum of modern art,hunter college,2
274,1.0,Investment Management,administrative coordinator,10.58,Bachelor,nyc hedge fund 26 billion aum,mercyhurst university,2
164,2.0,Truck Transportation,consulting engineer,29.59,MBA,u s department of transportation usdot,the cooper union for the advancement of science and art,2
254,2.0,Media Production,writer,9.59,Bachelor,business insider,stony brook university,2
318,1.0,Wellness and Fitness Services,admissions,7.0,Master,memorial sloan kettering cancer center,monroe college,2
263,2.0,Hospital & Health Care,staffing,9.41,MBA,montefiore health system,mercy college,2
207,5.0,Non-profit Organization Management,professor,1.92,Master,st john s university,st john s university,2
160,2.0,Medical Practices,clinical research,30.84,Doctor,icahn school of medicine at mount sinai,stony brook medicine,2
277,2.0,Performing Arts,substitute teacher,18.17,Bachelor,big league productions,schreyer honors college at penn state,2
168,3.0,"Health, Wellness & Fitness",nursing,13.42,empty,mount sinai st luke s institute for bariatric and minimally invasive surgery,new york university,2
349,1.0,Graphic Design,teaching,7.4,Bachelor,university of michigan,university of michigan,2
157,4.0,Apparel & Fashion,stylist,5.0,Master,dilara findikoglu,central saint martins university of the arts london,2
336,5.0,Renewables & Environment,sustainability,6.01,Master,apex clean energy,carnegie mellon university heinz college of information systems and public policy,2
188,2.0,Higher Education,professor,14.34,Doctor,yale university,princeton university,2
301,5.0,Fundraising,community relations,42.5,Bachelor,wingspan consulting llc,hampshire college,2
269,2.0,Research Services,research,14.5,Doctor,hexmodal,icahn school of medicine at mount sinai,2
297,1.0,Publishing,student,7.0,Bachelor,writers house,columbia university graduate school of journalism,2
395,3.0,Nanotechnology Research,research scientist,9.84,Doctor,harry s inc,penn state university,2
343,4.0,Telecommunications,aircraft technician,46.0,empty,nu labs inc,new jersey institute of technology,2
392,2.0,Apparel & Fashion,style,15.66,empty,j hilburn,montclair state university,2
298,2.0,Research Services,professor,26.57,Doctor,zhejiang guangsha university of construction,fordham university,2
199,1.0,Higher Education,store,11.0,Bachelor,all pro billing solutions llc,pomorsk state university named after m v lomonosov,2
169,6.0,Real Estate,photographer,13.25,Bachelor,dna design co,the calhoun school,2
195,4.0,Accounting,accounting,15.66,MBA,petra funds group,saint peter s university,2
229,1.0,Hospital & Health Care,public relations,7.07,empty,rutgers university,rutgers university new brunswick,2
196,2.0,Hospital & Health Care,physician,10.33,Doctor,urology care alliance,columbia university vagelos college of physicians and surgeons,2
270,3.0,Research,research analyst,18.18,Doctor,unfpa brasil,universidade federal fluminense,2
224,4.0,Government Administration,social,17.75,Master,coro new york leadership center,long island university,2
299,4.0,Pharmaceuticals,admissions,12.76,empty,bristol myers squibb,monmouth university,2
248,4.0,Advertising Services,gm,12.0,Bachelor,giovanni cilberto,parsons school of design the new school,2
301,2.0,Financial Services,research,18.0,Doctor,the d e shaw group,harvard university,2
221,5.0,Education Administration Programs,occupational therapist,19.64,Master,greystone park psychiatric hospital,kean university,2
197,2.0,Defense and Space Manufacturing,consulting engineer,24.59,Bachelor,federal aviation administration,project management institute,2
186,1.0,Writing & Editing,teaching,13.83,Bachelor,clarkstown central school district,southern new hampshire university,2
193,5.0,Retail Apparel and Fashion,buying,4.84,Bachelor,meticulous knitwear,the art institute of california san francisco,2
409,5.0,Architecture & Planning,marketing,15.58,Bachelor,adler lighting sales,state university of new york at plattsburgh,2
396,2.0,Music,photo,7.25,Bachelor,mk productions,montclair state university,2
279,4.0,Research,scientist,8.92,Doctor,pfizer,university of gothenburg,2
237,2.0,Legal Services,law,6.41,Doctor,the legal aid society,syracuse university college of law,2
308,1.0,Apparel & Fashion,social media marketing,5.17,Bachelor,expertvoice,university of iowa,2
259,4.0,Marketing & Advertising,wealth,8.08,empty,mindshare,university of pittsburgh,2
267,4.0,Legal Services,research engineer,18.24,Doctor,goodwin,college of nanoscale sciece and engineering suny albany,2
269,3.0,Design Services,graphic design,18.09,Master,community solutions inc,city university of new york hunter college,2
158,1.0,Primary/Secondary Education,substitute teacher,34.09,Master,wayne hills high school,william paterson university of new jersey,2
334,3.0,Automotive,sales customer service,12.92,MBA,genesis motor america,grand canyon university,2
316,2.0,Market Research,research scientist,5.68,Doctor,columbia technology ventures,columbia university in the city of new york,2
227,1.0,Photography,photographer,19.58,Master,nyc department of education,new york university,2
204,2.0,Computer Software,software engineer,5.99,Bachelor,the new york times,city university of new york,2
185,2.0,Media Production,spring,5.58,Bachelor,mediacom,university of connecticut,2
249,3.0,Non-profit Organization Management,small business,5.5,Bachelor,green dog walks llc,new york university,2
156,5.0,Non-profit Organizations,directors,37.84,Master,american associates of the sts forum 501 c3,teachers college columbia university,2
336,4.0,Food and Beverage Manufacturing,marketing sales,23.41,Bachelor,givaudan,tecnológico de monterrey,2
352,1.0,Entertainment Providers,actor,51.0,Bachelor,john eckert,university of north texas,2
270,1.0,Executive Offices,administrative,15.42,empty,blackstone,delaware state university,2
319,2.0,Real Estate,financial consultant,10.25,Master,the richman group,bentley university mccallum graduate school of business,2
157,3.0,"Health, Wellness & Fitness",community,39.48,Bachelor,the fort nyc,hobart and william smith colleges,2
264,3.0,Research Services,professor,10.08,Doctor,barnard college,new york university,2
159,5.0,Security & Investigations,security,19.33,Bachelor,flexcar,western connecticut state university,2
222,2.0,Hospital & Health Care,clinical,1.0,Doctor,new york presbyterian hospital,columbia university school of nursing,2
251,5.0,Design Services,architect,1.83,Bachelor,fashion institute of technology,fashion institute of technology,2
188,2.0,Writing & Editing,writer,10.83,Master,formedics,monmouth university,2
213,7.0,Venture Capital & Private Equity,accountant,21.34,MBA,stonepeak infrastructure partners,university of virginia darden school of business,2
330,1.0,Higher Education,public relations,10.16,Bachelor,suny college of optometry university eye center,syracuse university,2
368,1.0,Architecture & Planning,research,5.4,Doctor,princeton university,princeton university,2
367,4.0,Research,research,9.83,Master,werk insight,fordham university graduate school of arts and sciences,2
339,4.0,Primary/Secondary Education,teacher,20.74,Master,the city college of new york,city university of new york city college,2
268,1.0,International Affairs,reporter,4.66,Master,unicef,美国哥伦比亚大学,2
309,4.0,"Appliances, Electrical, and Electronics Manufacturing",commercial sales,3.51,empty,comelit group s p a,cuny new york city college of technology,2
312,3.0,IT Services and IT Consulting,software quality assurance engineer,15.17,Bachelor,abridge,cuny new york city college of technology,2
158,3.0,Recreational Facilities,small business,11.92,empty,kristi s kanines,baruch college,2
226,5.0,Financial Services,strategy business development,28.24,MBA,dun bradstreet,montclair state university,2
343,2.0,"Health, Wellness & Fitness",teacher,19.99,Doctor,psychotherapy spirituality institute,new york university,2
338,6.0,Accounting,financial consultant,16.33,Master,tan associates inc,university of michigan stephen m ross school of business,2
352,3.0,Retail Luxury Goods and Jewelry,small business,14.0,Bachelor,j demichael fine jewelry,university of maryland,2
185,1.0,Automotive,brand,5.43,Bachelor,audi of america,baruch college,2
319,3.0,Hospital & Health Care,teaching,15.67,Master,mount sinai health system,adelphi university,2
345,2.0,Financial Services,consulting engineer,10.51,Bachelor,bank of america,university of maine,2
217,1.0,Cosmetics,social media,6.66,Bachelor,chf industries,parsons school of design the new school,2
319,4.0,Medical Practice,physician,6.0,Doctor,nyu langone health,duke university,2
345,2.0,Accounting,tax consultant,2.08,Bachelor,deloitte,cuny york college,2
209,5.0,Architecture and Planning,gm,2.0,Bachelor,just fries italy,seconda università degli studi di napoli,2
257,5.0,Accounting,billing analyst,16.33,Bachelor,mufg,baruch college,2
404,2.0,"Health, Wellness & Fitness",financial adviser,7.57,empty,the better choice lenders,clifton high school,2
216,1.0,Accounting,tax accountant,5.66,Bachelor,pwc,city university of new york brooklyn college,2
260,2.0,Computer Software,it developer,9.17,Bachelor,mitsui bussan commodities ltd,gujarat university,2
356,2.0,Wellness and Fitness Services,education,8.0,Associate,center moriches umc,suny farmingdale adelphi university,2
160,1.0,Entertainment,secretary,4.67,Bachelor,the dermot company lp,brown university,2
228,3.0,Entertainment,actor,17.75,Bachelor,self employed,schiller college london england,2
340,4.0,Law Practice,professor,7.25,Doctor,esquire cle,boston university school of law,2
240,1.0,Cosmetics,customer service sales,10.32,empty,sephora,western connecticut state university,2
256,2.0,Real Estate,real estate broker,6.09,Bachelor,luxury living by michael hern,university of south carolina,2
371,3.0,Research Services,research scientist,11.5,Doctor,nyu langone health,rutgers university,2
163,2.0,Hospitals and Health Care,application analyst,3.83,Associate,mount sinai health system,nassau community college,2
363,4.0,Accounting,financial analyst,7.25,Bachelor,pwc,boston college,2
178,4.0,Business Consulting and Services,business coordinator,12.34,MBA,alvarez marsal,touro university,2
220,4.0,Software Development,application development,8.25,Master,jpmorgan chase co,bits pilani,2
190,2.0,Staffing & Recruiting,marketing coordinator,13.93,Bachelor,nnn pro,lim college,2
291,2.0,Textiles,stylist,11.07,Bachelor,style library,syracuse university,2
218,2.0,Architecture and Planning,designer,10.58,Bachelor,gensler,pratt institute,2
254,3.0,Internet,investment,24.08,Bachelor,j p morgan,reforge,2
337,3.0,Information Technology & Services,it project,21.92,Bachelor,sumitomo mitsui trust bank u s a limited,stony brook university,2
290,2.0,Higher Education,teacher,8.66,Master,avenues the world school,columbia university in the city of new york,2
249,2.0,Hospitality,data analyst,7.9,Bachelor,highgate,university of maryland,2
261,5.0,Non-profit Organization Management,law,14.08,MBA,hodgson russ llp,city university of new york college of staten island,2
300,2.0,Government Administration,teaching,10.16,Master,fund for public health in nyc,cuny graduate school of public health and health policy,2
276,6.0,Hospital & Health Care,physician,11.74,Master,newyork presbyterian hospital,the city university of new york,2
214,1.0,Staffing & Recruiting,clerical,7.91,Bachelor,mount sinai health system,champlain college,2
351,1.0,Defense & Space,research,5.0,empty,nasa national aeronautics and space administration,yale university,2
204,2.0,Research,research scientist,14.84,Doctor,new york university school of medicine,university of illinois at chicago,2
172,5.0,Research,environment health safety,38.58,Master,retired,rutgers university,2
191,1.0,Performing Arts,stage,21.09,Master,rei,rutgers university,2
161,2.0,Government Administration,captain,2.83,Bachelor,us navy,university at buffalo,2
318,5.0,Retail,web application developer,14.25,empty,ralph lauren,university of pennsylvania,2
326,6.0,Banking,credit analyst,25.0,MBA,td bank n a,state university of new york at buffalo school of management,2
171,3.0,Higher Education,professor,14.42,Doctor,cambodian rock band 2023 tour,the graduate center city university of new york,2
272,2.0,Hospitals and Health Care,clinical,35.58,Master,new york presbyterian hospital,city university of new york hunter college,2
206,1.0,Real Estate,quality coordinator,21.83,empty,csl plasma,seton hall university,2
168,4.0,Fine Art,professor,9.66,Master,maine media workshops college,new york studio school of drawing painting sculpture,2
152,1.0,Hospitals and Health Care,social worker,4.17,Master,new york presbyterian hospital,adelphi university,2
241,3.0,Hospital & Health Care,nursing,3.17,Bachelor,cooperman barnabas medical center,rutgers school of nursing,2
287,3.0,Biotechnology Research,engineer,14.17,Doctor,johnson johnson medtech,duke university,2
349,5.0,Design,visual designer,24.58,empty,nbbj esi design,new york university,2
355,5.0,Marketing & Advertising,finance,30.17,Bachelor,biolumina,university at albany,2
363,6.0,Financial Services,capital markets,15.5,Bachelor,mizuho,university of delaware,2
374,3.0,Education Administration Programs,teacher,15.75,Master,cloud forest school centro de educación creativa,the university of texas at austin,2
336,1.0,International Affairs,translator,27.0,Master,united nations,harvard university,2
373,1.0,Book and Periodical Publishing,administrative coordinator,18.58,Bachelor,marsh mclennan,baruch college,2
153,1.0,Medical Device,sales representative,16.59,empty,iscreen vision inc,inactive 1703030558 liu brooklyn,2
182,6.0,Law Practice,attorney,16.66,Doctor,haworth barber gerstman llc,brooklyn law school,2
174,3.0,Software Development,small business,15.83,MBA,dinner myway,new york institute of technology old westbury,2
346,3.0,Biotechnology,professor,14.49,Doctor,icahn school of medicine at mount sinai,université de nantes,2
371,3.0,Pharmaceuticals,scientist,9.5,Doctor,cornell university,peking union medical college,2
266,4.0,Apparel & Fashion,buying,3.25,Bachelor,geneva home fashion,lim college,2
184,4.0,Entertainment Providers,producer,9.75,Bachelor,abc news,purchase college suny,2
194,4.0,Computer Software,client support,37.33,empty,bottomline technologies,rider university,2
362,2.0,Performing Arts,writer,14.23,Doctor,disney theatrical group,columbia law school,2
337,2.0,Writing & Editing,writer,23.17,Master,author of articles on natural history science arts and discovery,princeton university,2
177,2.0,Architecture & Planning,architect,4.99,Bachelor,paul a castrucci architects,new york institute of technology,2
184,3.0,Marketing & Advertising,social media,5.08,Bachelor,spark foundry,university of connecticut,2
318,3.0,Insurance,underwriter,8.91,Bachelor,allianz commercial,st thomas aquinas college,2
213,2.0,Mental Health Care,home,4.0,Master,presence of mind therapy,columbia university,2
196,4.0,Online Media,photographer,24.33,Master,apple,new york university,2
346,3.0,Hospital & Health Care,rn,4.17,Bachelor,plastic surgery institute of new york,chamberlain university,2
252,1.0,Primary/Secondary Education,teacher,7.58,Master,hackensack board of education,dominican college of blauvelt,2
294,1.0,Hospitals and Health Care,help,14.25,Bachelor,health village imaging,southern new hampshire university,2
190,3.0,Construction,real estate broker,0.91,Bachelor,ryan company,nichols college,2
180,1.0,Investment Management,research scientist,0.5,Bachelor,toyota north america,columbia university in the city of new york,2
345,4.0,Advertising Services,marketing coordinator,23.25,Master,leo burnett,university of macau,2
218,5.0,Media Production,strategic,0.33,Bachelor,abc sports 2007 college football scoreboard show,boston university,2
288,4.0,Higher Education,consulting,9.08,Doctor,teachers college columbia university,columbia university in the city of new york,2
212,2.0,Financial Services,account analyst,7.25,Bachelor,blackrock,rutgers university,2
300,4.0,Retail Apparel and Fashion,merchandising,17.58,Bachelor,haddad brands,berkeley college new york,2
350,3.0,Hospital & Health Care,content creator,14.59,Bachelor,medscape,university of california berkeley,2
161,5.0,Internet,coach,34.41,Master,home,rensselaer polytechnic institute,2
354,3.0,Construction,investigations,14.1,Bachelor,columbia university in the city of new york,binghamton university,2
297,1.0,Non-profit Organization Management,paramedic,16.83,Bachelor,hudson regional health commission,rutgers university new brunswick,2
187,2.0,Higher Education,research scientist,13.82,Doctor,new york state department of health,harvard university,2
282,2.0,Research,research scientist,9.66,Doctor,the johns hopkins university,weill cornell graduate school of medical sciences,2
164,1.0,Pharmaceuticals,research scientist,13.83,Doctor,novartis institutes for biomedical research nibr,rutgers university new brunswick,2
325,5.0,IT Services and IT Consulting,systems engineering,15.08,Bachelor,dell technologies,northeastern university,2
154,2.0,Higher Education,research scientist,11.24,Doctor,columbia university irving medical center,stanford university,2
255,3.0,Financial Services,teacher,6.9,Bachelor,bank of america,new york university,2
209,3.0,Investment Management,financial reporting analyst,4.0,Bachelor,balyasny asset management,binghamton university,2
236,7.0,Hospitality,md,5.0,Bachelor,www ricardoralphlopez com www sunsetrdv com,lycee alexandre dumas haiti,2
352,3.0,Hospital & Health Care,research,20.42,Doctor,suny downstate medical center,university of the basque country,2
291,1.0,Marketing & Advertising,promotions,10.49,Bachelor,lincoln tech,montclair state university,2
195,1.0,Higher Education,security officer,9.16,MBA,carolina cyber center,mercy university,2
245,3.0,Hospitals and Health Care,professor,24.93,Doctor,lund university,lund university faculty of medicine skåne sweden,2
269,2.0,Financial Services,marketing research,1.82,Bachelor,american express,new york university,2
191,1.0,Construction,construction project,16.66,Doctor,elmhall millworks inc,belarus state economic university,2
320,5.0,International Affairs,reporter,4.41,Doctor,united nations,charles university in prague,2
230,4.0,Construction,superintendent,5.25,Bachelor,reidy contracting group,technological university of the shannon,2
319,2.0,Hospital & Health Care,clinical,12.99,Master,weill cornell medicine,michigan state university,2
181,2.0,Biotechnology,research engineer,3.16,Doctor,caltech,harvey mudd college,2
258,2.0,Financial Services,accounting,7.0,Bachelor,cornick garber sandler llp,baruch college,2
289,1.0,Hospital & Health Care,nurse,6.74,Bachelor,new york state department of health,stony brook university,2
306,1.0,Hospitals and Health Care,teaching,13.67,Master,coty,st john s university,2
199,4.0,Manufacturing,cost accountant,39.16,empty,marathon enterprises inc,hudson county community college,2
332,3.0,Computer Software,graphic design,11.25,empty,dreamwear,notre dame university louaize ndu,2
233,5.0,Higher Education,professor,15.99,Doctor,the unscene theatre company,the graduate center city university of new york,2
217,2.0,Research,research,7.08,Doctor,cornell university,university of florida,2
171,4.0,Publishing,business analyst,21.83,Bachelor,the walt disney company,university of pennsylvania,2
201,1.0,Research,laboratory technician,8.99,Doctor,nyu grossman school of medicine,new york university,2
363,2.0,Research,research scientist,9.08,Doctor,cornell high energy synchrotron source,cornell university,2
235,4.0,Higher Education,physician,13.4,Doctor,harbor ucla medical center,columbia university vagelos college of physicians and surgeons,2
214,4.0,Human Resources Services,finance operations,22.91,Bachelor,leboo inc,university at buffalo,2
203,3.0,Computer Software,software engineer,9.92,Bachelor,motorola solutions,queens college,2
336,2.0,Financial Services,software programmer,0.67,Bachelor,polaris7 investments llc,university of southern california,2
321,5.0,Hospital & Health Care,professor,8.67,Doctor,new york proton center,tianjin university,2
247,5.0,Hospitals and Health Care,application analyst,14.0,empty,catholic health services,university of florida,2
380,2.0,Music,video editor,29.51,empty,gut feeling,avid,2
316,4.0,Financial Services,account analyst,15.5,Bachelor,citi,stony brook university,2
356,5.0,Financial Services,directors,17.01,Bachelor,supplemental health care,unniversity of pennsylvania wharton school,2
323,1.0,Hospital & Health Care,public relations,17.56,Bachelor,nyu langone health,universidad del sagrado corazón,2
347,1.0,Apparel & Fashion,stylist,16.91,MBA,ross stores inc,hampton university,2
312,2.0,Publishing,editor,8.17,Bachelor,time out new york kids,williams college,2
252,5.0,Entertainment,writer,31.0,Master,off center for the dramatic arts,university of vermont,2
254,2.0,Higher Education,teaching,19.9,Bachelor,stony brook university graduate school,stony brook university,2
355,3.0,Accounting,tax preparer,4.83,Master,grassi,hofstra university,2
325,5.0,Research Services,research scientist,12.09,Doctor,schrödinger,rmit university,2
325,5.0,Retail Apparel and Fashion,creative,17.33,Bachelor,equality new york designs,fashion institute of technology,2
282,3.0,Higher Education,research scientist,12.5,Doctor,columbia university irving medical center,indian institute of science education research iiser kolkata,2
271,4.0,Luxury Goods & Jewelry,salesperson,15.42,empty,fendi,mt san antonio college,2
244,1.0,Writing & Editing,teacher,11.84,Master,consumeraffairs,touro university worldwide,2
272,2.0,Research Services,teaching,1.75,Doctor,columbia university in the city of new york,the university of chicago,2
327,5.0,Software Development,software engineer,9.92,Bachelor,google,george mason university,2
307,4.0,IT Services and IT Consulting,research engineer,7.58,Master,ibm,indiana university bloomington,2
308,2.0,Administration of Justice,law,41.17,Doctor,presiding justice trial part 38 supreme court manhattan,new york university,2
428,2.0,Biotechnology,research engineer,3.09,Bachelor,massachusetts institute of technology,the city college of new york,2
361,4.0,Photography,producer,14.33,empty,wagner college,sva ny,2
163,1.0,Hospital & Health Care,physical therapist,4.16,Bachelor,staten island university hospital,kingsborough community college,2
231,3.0,Research,research,5.33,Doctor,rptu kaiserslautern landau,universität der künste berlin,2
391,7.0,Entertainment Providers,directors,14.16,Bachelor,love squad,institute of integrative nutrition,2
355,3.0,Higher Education,research technician,3.16,Doctor,georgia tech research institute,georgia institute of technology,2
205,4.0,Hospital & Health Care,professor,25.09,Bachelor,joan sanford i weill medical college of cornell university,michigan state university,2
186,1.0,Staffing & Recruiting,home,18.67,Bachelor,robert half,city and islington college,2
335,4.0,Writing & Editing,editor,16.91,Bachelor,the kim loo sisters,alliance française paris france,2
240,3.0,Education Management,superintendent,32.5,Master,roman catholic diocese of brooklyn,st john s university,2
206,2.0,Computer Software,software programmer,6.75,Bachelor,macquarie group,university of north florida,2
291,1.0,Accounting,tax preparer,4.83,Bachelor,internal revenue service,state university of new york at old westbury,2
165,5.0,Retail Apparel and Fashion,strategic accounts,37.83,empty,texport syndicate india ltd,pace university,2
197,1.0,Publishing,reporter,10.59,Master,the new press,new york university,2
202,6.0,Investment Banking,md,10.0,MBA,montgomery advisors llc,the university of texas at austin,2
296,2.0,Medical Practice,scientific,4.91,empty,applied isotope technologies,boston university 6 yr medical program,2
253,2.0,Retail Apparel and Fashion,sales representative,6.84,Bachelor,temple st clair,lim college,2
432,4.0,Management Consulting,research analyst,3.33,empty,metropolitan transportation authority,nyu stern school of business,2
331,1.0,Insurance,tax preparer,13.66,Bachelor,crisp insurance advisors,rutgers university,2
221,4.0,Graphic Design,graphic design,10.16,Bachelor,inspiren,northeastern university,2
364,3.0,Pharmaceuticals,clinical research,11.91,Doctor,target health full service cro,rutgers university,2
312,3.0,Computer Software,research scientist,7.83,Doctor,meta,university of colorado boulder,2
338,2.0,Performing Arts,artist,14.98,Bachelor,motus the company,east carolina university,2
185,5.0,Civil Engineering,construction,27.41,MBA,extell,nyit school of management,2
263,5.0,Motion Pictures & Film,game designer,31.75,Bachelor,alice blue,hofstra university,2
288,2.0,Entertainment Providers,communications coordinator,19.33,Bachelor,the jewish theological seminary jts,barnard college,2
194,5.0,Medical Practices,medical,53.91,Doctor,combative sports consulting services,stony brook university,2
282,4.0,Architecture & Planning,architect,9.17,Master,diller scofidio renfro,harvard university graduate school of design,2
260,3.0,Financial Services,financial services,4.41,Bachelor,robinhood,uc irvine,2
173,2.0,Design,graphic design,0.17,Bachelor,yoka games,savannah college of art and design,2
384,4.0,Computer Software,student,9.33,Doctor,google,university of michigan rackham graduate school,2
263,1.0,Research Services,research,18.92,Doctor,memorial sloan kettering cancer center,the institute of cancer research,2
330,3.0,Research,teaching,7.0,Doctor,regeneron,university of michigan,2
