numconnections,seniority,currentindustry,mapped_role,total_experience_years,highest_degree,company_cleaned,campus_cleaned,cluster_id
500,5.0,Pharmaceuticals,human resources business,15.57,Master,daiichi sankyo inc,rutgers university,0
500,5.0,Financial Services,compliance officer,10.43,Master,francisco partners,cornell university,0
500,3.0,Broadcast Media,promotions,6.49,empty,fox news media,the college of new jersey,0
500,3.0,Investment Banking,investment banking analyst,8.01,empty,goldman sachs,university of wisconsin madison,0
500,6.0,Insurance,financial officer,30.58,MBA,global atlantic financial group,cornell johnson graduate school of management,0
500,3.0,Civil Engineering,electrical engineering,5.91,MBA,gft,stony brook university,0
500,3.0,Market Research,research,10.41,Master,ferring pharmaceuticals,north carolina state university,0
500,5.0,IT Services and IT Consulting,software architect,18.17,Master,point72,stony brook university,0
500,6.0,Marketing & Advertising,copywriter,15.01,Master,edelman,columbia university in the city of new york,0
500,5.0,Banking,investments,15.58,empty,bayerische landesbank,berufsakademie muenchen,0
500,7.0,Financial Services,small business,24.17,Master,affluent group,mercy college,0
500,1.0,Writing and Editing,editor,18.34,Master,delish,new york university,0
500,6.0,Media Production,content creator,9.24,empty,good kind media llc,university of southern california,0
500,1.0,Higher Education,teaching,6.16,Master,adapt community network,teachers college columbia university,0
500,6.0,Financial Services,investor relations,8.83,Master,ubs,university of michigan stephen m ross school of business,0
500,3.0,Writing and Editing,study,8.25,Master,north jersey transportation planning authority,rutgers university edward j bloustein school of planning and public policy,0
488,1.0,Higher Education,counselor,14.41,empty,seeds of peace,tufts university,0
500,2.0,Law Practice,teaching,7.41,Master,landesa,nyu tisch school of the arts,0
500,6.0,Insurance,attorney,5.0,Master,vistage worldwide inc,manhattan university,0
500,4.0,Advertising Services,social media,15.51,Master,the national society of leadership and success nsls,wilkes university,0
500,5.0,Computer Software,products,8.83,Master,instagram,georgia institute of technology,0
500,5.0,Financial Services,capital markets,1.5,MBA,bny,university of california davis graduate school of management,0
500,5.0,Software Development,software engineering,15.5,Master,unqork,university of southern california,0
500,6.0,Research,strategy consultant,22.41,Master,the ostrom project,massachusetts institute of technology,0
500,1.0,Food & Beverages,events,9.5,empty,canard inc,concordia university chicago,0
500,7.0,Financial Services,directors,10.68,Master,amé fashion international enterprises ltd,harvard business school,0
437,3.0,Hospitals and Health Care,scientific,16.83,Master,merck,university of rochester,0
500,2.0,Hospitals and Health Care,realtor,22.59,empty,a place for mom,nassau community college,0
500,3.0,Financial Services,research analyst,5.33,Master,canaccord genuity global capital markets,villanova university,0
500,4.0,Construction,capital markets,12.0,MBA,rostan solutions llc,the university of chicago booth school of business,0
500,3.0,Computer Software,software engineering,11.0,Master,neo4j,university of california berkeley,0
500,4.0,Manufacturing,market,21.42,empty,scn hospitality patron saint branca midtown velvet belly bitter honey the revelry ziggy s,york college of pennsylvania,0
500,3.0,Law Enforcement,counselor,16.75,High School,manhattan district attorney s office,barnard college,0
500,5.0,Real Estate,investments,20.25,MBA,stacksource,hofstra university,0
500,2.0,Marketing & Advertising,data scientist,16.49,Master,manning publications co,fordham gabelli school of business,0
500,3.0,Online Media,journalist,23.25,Master,self employed,temple university,0
500,4.0,Investment Management,technology architect,16.34,empty,cms compliance group inc,carnegie mellon university,0
500,6.0,Banking,research analyst,30.92,Doctor,barclays corporate investment bank,princeton university,0
500,4.0,Higher Education,communications coordinator,28.16,Master,citizen schools,university of maryland global campus,0
500,4.0,Higher Education,professor,23.24,Master,columbia school of social work,emory university,0
500,5.0,Sports,promotions,22.75,Master,new york football giants,west virginia university,0
500,5.0,Banking,lawyer,17.33,empty,crédit agricole cib,cornell university,0
500,3.0,Banking,hostess,6.58,MBA,authority magazine,strayer university,0
500,6.0,Investment Management,capital markets,31.0,MBA,https www unified software ai com solutions,massachusetts institute of technology,0
500,2.0,Fine Art,teaching,7.67,Master,cornell university,cornell university,0
500,3.0,Insurance,financial planner,23.09,MBA,life insurance,nys prometric,0
500,5.0,Business Consulting and Services,investment,12.26,Master,danske bank large corporates institutions,cfa institute,0
500,7.0,Accounting,financial officer,26.5,MBA,ey,saint peter s university,0
500,5.0,Design,content creator,36.66,MBA,art basel,school of visual arts,0
367,2.0,Veterinary Services,research scientist,5.32,Master,regeneron,university of illinois at urbana champaign,0
500,4.0,Telecommunications,network analyst,16.5,empty,wells fargo,fordham university,0
497,3.0,Software Development,database engineer,24.99,empty,smbc group,bms consulting,0
500,1.0,Public Relations & Communications,social media,22.15,Master,victoria s secret co,university of florida,0
500,1.0,Higher Education,teacher,3.58,Master,international rescue committee,columbia university,0
500,3.0,Broadcast Media Production and Distribution,producer,24.0,Master,cnn,east carolina university,0
371,3.0,Information Technology & Services,officer,7.26,Master,bonfire ads pvt ltd,bentley university,0
463,3.0,Hospital & Health Care,clinical,7.42,empty,newyork presbyterian hospital,stony brook university,0
500,2.0,Architecture & Planning,architect,4.08,Master,hlw,columbia university graduate school of architecture planning preservation,0
500,1.0,Accounting,tax preparer,4.25,Master,hps investment partners llc,penn state university,0
500,5.0,Venture Capital and Private Equity Principals,equity,17.26,empty,shad canada,harvard university,0
500,1.0,Professional Training & Coaching,counselor,3.25,Master,wibn national,montclair state university,0
500,6.0,Management Consulting,strategic,8.33,Master,traxion group inc,gies college of business university of illinois urbana champaign,0
445,4.0,Chemical Manufacturing,production engineering,18.42,Master,iff,southern methodist university,0
500,2.0,"Movies, Videos and Sound",artist,33.05,Master,international studio curatorial program iscp,virginia tech,0
500,5.0,Pharmaceutical Manufacturing,clinical project,30.41,Master,eclinical solutions,university of california berkeley,0
500,5.0,IT Services and IT Consulting,systems architect,21.0,Master,party city,bond university,0
500,1.0,Financial Services,client service representative,2.67,Master,moody s analytics,stevens institute of technology,0
500,7.0,Marketing & Advertising,strategist,24.16,Master,mccann worldgroup,vassar college,0
500,5.0,Online Audio and Video Media,strategist,20.67,MBA,svci silicon valley ciso investments,western governors university,0
421,5.0,Construction,architect,34.59,empty,vva project cost managers,smith college,0
490,3.0,IT Services and IT Consulting,it support technician,23.58,empty,ørsted,cittone institute,0
500,7.0,Computer Software,distributor,22.66,MBA,decoupling co,mit sloan school of management,0
500,5.0,IT Services and IT Consulting,solutions architect,21.66,Master,netapp,university of mumbai,0
376,5.0,Higher Education,teacher,9.51,Master,sacred heart university,sacred heart university,0
500,4.0,Computer Software,software engineering,16.17,Master,modal labs,stanford university,0
500,2.0,Financial Services,quantitative analyst,5.82,Master,citi,new york university,0
484,2.0,Mental Health Care,social worker,11.92,Master,the quad preparatory school,new york university,0
500,6.0,Management Consulting,professor,11.67,Master,wellspring consulting,yale divinity school,0
500,5.0,Marketing & Advertising,social media,17.08,Master,launchgood,georgetown university,0
500,1.0,Insurance,business development consultant,5.66,MBA,the weather channel,montclair state university,0
500,3.0,Information Technology & Services,data engineer,6.25,Master,bulkmagic,clarkson university,0
400,1.0,Financial Services,reporting,0.17,Master,lucion chicheng venture capital investment management ltd,fordham gabelli school of business,0
500,2.0,Financial Services,capital markets,21.17,MBA,bank of america merrill lynch,rutgers university,0
500,5.0,IT Services and IT Consulting,consultant project,19.0,MBA,lf decentralized trust,indian institute of management ahmedabad,0
500,5.0,Human Resources Services,human resources business,16.0,Master,buzzfeed,buffalo state university,0
500,2.0,Law Enforcement,security,26.0,empty,hoboken police department,bergen county law and public safety institute,0
500,6.0,Online Audio and Video Media,mergers acquisitions,16.5,MBA,deloitte,new york university,0
500,5.0,Information Technology & Services,business strategy,8.25,MBA,exl,university of virginia darden school of business,0
500,2.0,Hospitality,data scientist,4.91,Master,mckinsey company,purdue university,0
500,4.0,Financial Services,investment,10.91,MBA,axumis,hofstra university,0
500,5.0,Financial Services,data analytics,32.33,MBA,sutherland,duke university the fuqua school of business,0
500,1.0,Real Estate,real estate broker,25.17,empty,exp realty,360 training,0
483,1.0,Mental Health Care,research,8.15,Master,columbia university department of psychiatry and new york state psychiatric institute,teachers college columbia university,0
373,2.0,International Affairs,affairs,1.5,Master,u s department of state,columbia university,0
458,6.0,Financial Services,capital markets,8.17,MBA,bluerock,northeastern university,0
500,2.0,Computer Software,research,5.24,Master,two sigma,uc santa barbara,0
361,2.0,Writing and Editing,substitute teacher,11.5,Master,merrick academy queens public charter school,suny oneonta,0
500,5.0,E-Learning Providers,sales business development,32.84,empty,greenwich tent company,southern connecticut state university,0
500,4.0,Financial Services,business strategy,15.83,MBA,meta,cornell johnson graduate school of management,0
500,6.0,Marketing & Advertising,brand marketing,19.0,empty,publicis production,colorado state university,0
500,4.0,Financial Services,business data analyst,6.67,Master,etoro,baruch college,0
500,5.0,Investment Banking,portfolio,17.16,MBA,centre lane partners llc,college of the holy cross,0
500,6.0,Media Production,producer,14.17,MBA,medrina,cornell johnson graduate school of management,0
500,6.0,"Museums, Historical Sites, and Zoos",directors,15.83,Master,society of winterthur fellows,university of delaware,0
381,1.0,Broadcast Media,journalist,16.66,Master,globo,new york university,0
392,3.0,Marketing & Advertising,financial analyst,16.42,MBA,omnicom,suny empire state college,0
446,3.0,Investment Management,investments,5.0,MBA,family office,columbia business school,0
500,6.0,Real Estate,mergers acquisitions,16.5,MBA,global holdings management group,the wharton school,0
500,5.0,Manufacturing,brand marketing,19.58,MBA,girl scouts of the usa,northwestern university kellogg school of management,0
500,3.0,Investment Management,software engineer,3.75,Master,agam capital,syracuse university,0
500,5.0,Banking,economist,10.58,MBA,strategy,yale school of management,0
500,7.0,Investment Banking,business developer,9.67,empty,dcc capital,mines paris psl,0
376,1.0,Higher Education,teacher,3.5,Master,naaleh high school for girls,bernard revel graduate school of jewish studies,0
500,5.0,Financial Services,capital markets,15.83,Master,hilltop securities inc,georgetown university,0
500,6.0,Accounting,tax accountant,21.92,empty,crosscountry consulting,fairleigh dickinson university,0
500,6.0,Information Technology & Services,software architect,12.51,empty,galans group consulting llc,mays business school texas a m university,0
500,3.0,Government Relations,coordinator,22.59,Master,undp,universidad de los andes,0
500,6.0,Advertising Services,creative,18.83,empty,droga5,salem state university,0
500,5.0,Management Consulting,research analyst,18.06,MBA,deloitte,general assembly,0
500,5.0,Professional Training and Coaching,ambassador,41.08,empty,transform your performance,fremdspracheninstitut der landeshauptstadt münchen,0
500,3.0,Public Relations and Communications,host,20.16,Master,gregory fca,columbia university graduate school of journalism,0
500,5.0,Research Services,strategy consultant,4.17,MBA,bain company,ivey business school at western university,0
500,5.0,Industrial Machinery Manufacturing,mechanical engineering,20.24,Master,linkedin,texas mccombs school of business,0
500,5.0,Design Services,creative,22.33,Master,ibm,missouri state university,0
500,5.0,Fine Art,content creator,8.58,Master,fl fine art llc,tulane university law school,0
500,6.0,Accounting,equity,4.76,empty,ees lighting llc,yeshiva university,0
500,6.0,Information Technology & Services,development,9.08,Master,fabritech software private limited,technical university of munich,0
500,4.0,Financial Services,marketing communications,4.49,empty,alpha agency formerly white marble consulting,rutgers university school of communication and information,0
500,2.0,Financial Services,investment analyst,1.24,Master,bnp paribas asset management,georgia institute of technology,0
363,4.0,Accounting,treasurer,6.74,MBA,accenture,molloy university,0
500,5.0,Advertising Services,creative,16.58,empty,ogilvy,miami dade college,0
500,6.0,IT Services and IT Consulting,user designer,9.84,MBA,rbc,symbiosis centre for management and human resource development,0
427,1.0,Education Management,teaching,10.83,Master,nyu center for the study of antisemitism,harvard graduate school of education,0
500,3.0,Business Consulting and Services,data analyst,9.82,Master,barclays,stevens institute of technology,0
500,3.0,Design Services,graphic designer,30.58,Master,bisnode sverige ab,mit xpro virtual reality and augmented reality,0
500,1.0,Banking,bank teller,15.34,empty,td,borough of manhattan community college,0
500,5.0,Broadcast Media Production and Distribution,writer,15.92,Master,local contexts,new york university,0
500,5.0,Higher Education,teaching,12.5,Master,eagleton institute of politics,rutgers school of graduate studies,0
500,2.0,Insurance,law,10.58,Master,seiden law,trinity college hartford,0
376,2.0,Primary/Secondary Education,teacher,17.34,Master,greenwich country day school,state university of new york college at buffalo,0
500,3.0,Financial Services,equity analyst,8.5,MBA,momentus securities,university of sussex,0
500,5.0,Public Relations and Communications Services,consumer marketing,12.25,Master,bcw global,syracuse university,0
350,1.0,Higher Education,social worker,8.99,Master,university settlement society of new york,george mason university college of health and human services,0
500,4.0,IT Services and IT Consulting,directors,17.67,MBA,ypo,mit sloan school of management,0
500,1.0,Financial Services,professor,11.0,Master,columbia university school of professional studies,florida international university college of business,0
500,5.0,Biotechnology Research,professor,16.58,empty,howard university,carnegie mellon university,0
429,2.0,Accounting,tax,7.5,empty,ey,queens college,0
500,4.0,Software Development,systems architect,9.91,MBA,mio partners inc,questrom school of business boston university,0
500,4.0,Banking,web developer,26.02,empty,commonwealth financial network,monmouth university,0
500,5.0,Venture Capital and Private Equity Principals,strategist,12.0,empty,sparkwise,princeton university,0
463,5.0,Software Development,development engineer,9.83,Master,the estée lauder companies inc,drexel university,0
500,2.0,Research,substitute teacher,24.07,empty,nyu langone health,st john s university,0
500,5.0,Marketing & Advertising,marketing communications,12.67,Master,linusbio,tel aviv university,0
500,3.0,Financial Services,affairs,9.66,Master,united nations secretary general s special advocate for financial health,columbia sipa,0
500,4.0,Financial Services,programmer analyst,23.5,empty,mightytech network,nyu scps,0
500,3.0,Marketing & Advertising,marketing consultant,26.33,MBA,jlh strategic advisors,william mary,0
376,1.0,Education Management,substitute teacher,3.41,Master,nyc department of education,stony brook university,0
500,2.0,Apparel & Fashion,design,4.33,Master,heike ny,fashion institute of technology,0
500,3.0,Non-profit Organizations,financial analyst,9.25,MBA,marsh mclennan,carnegie mellon university tepper school of business,0
500,3.0,Financial Services,equity research analyst,5.83,MBA,bank of america,the hong kong university of science and technology,0
500,3.0,Investment Management,capital markets,15.33,MBA,citi,the university of chicago booth school of business,0
500,6.0,"Technology, Information and Internet",marketing consultant,16.75,Master,new york life insurance company,walsh college,0
393,1.0,Entertainment,producer,5.09,High School,anonymous content,new york university,0
370,4.0,Information Technology & Services,it auditor,14.42,Master,paramount,baruch college,0
500,5.0,Hospitality,sales marketing,4.67,empty,westchester hills golf club,hofstra university,0
500,2.0,Insurance,wealth,5.83,empty,allied world,university at buffalo,0
500,5.0,IT Services and IT Consulting,strategic marketing,27.24,MBA,stavtar solutions,delhi university,0
500,5.0,"Technology, Information and Internet",technology officer,32.25,MBA,google,harvard medical school,0
500,6.0,Manufacturing,financial analysis,14.25,MBA,authentic brands group,cornell johnson mba,0
500,2.0,Motion Pictures & Film,producer,17.17,empty,global language team,university cadi ayad,0
500,5.0,Advertising Services,digital media,46.59,MBA,university of north carolina at chapel hill,the tuck school of business at dartmouth,0
500,3.0,Design,graphic design,13.82,Master,kiss products inc,cornell university,0
500,6.0,Computer Software,strategic marketing,15.0,empty,youtube,university of california berkeley,0
500,4.0,Performing Arts,actor,29.1,empty,nuevo tango arts,academia nacional del tango,0
500,1.0,Higher Education,nanny,17.07,Master,school professionals,new york university,0
500,3.0,Artists and Writers,artist,26.34,Master,self employed fine arts,pratt institute new york,0
500,6.0,Venture Capital & Private Equity,investment,12.34,empty,iconiq capital,columbia sipa,0
500,5.0,Manufacturing,communications,33.68,Master,yale school of medicine,nyu school of professional studies,0
500,3.0,"Museums, Historical Sites, and Zoos",teacher,13.74,Master,david kordansky gallery,the institute of fine arts nyu,0
500,3.0,"Movies, Videos and Sound",writer,3.83,empty,sterling lord literistic,the haberdashers aske s boys school,0
500,3.0,Financial Services,software engineer,18.09,Master,bloomberg lp,university of california berkeley haas school of business,0
450,2.0,Hospital & Health Care,clinical,27.06,Master,hackensack meridian health,northwestern university,0
445,4.0,"Appliances, Electrical, and Electronics Manufacturing",graphic design,9.0,Master,kaleidoscope learning,columbia university,0
500,3.0,Computer & Network Security,security analyst,23.35,Master,human,george mason university,0
500,3.0,Public Policy Offices,social,9.24,Master,alvarez marsal,columbia university mailman school of public health,0
500,3.0,Higher Education,actor,18.91,Master,new york university,teachers college of columbia university,0
500,2.0,Public Policy Offices,research,13.66,Master,national employment law project,columbia university,0
500,1.0,Entertainment Providers,admissions,2.75,Master,the university of scranton,brooklyn college,0
500,6.0,Accounting,financial consultant,9.66,Master,sax llp,archbishop molloy high school,0
500,5.0,Non-profit Organizations,community,22.67,Master,masterwork music and art foundation,cornell university,0
500,6.0,Computer Software,business development consultant,15.41,MBA,amazon web services aws,the tuck school of business at dartmouth,0
500,2.0,Management Consulting,investment analyst,4.16,MBA,mckinsey company,columbia business school,0
358,4.0,Accounting,tax accountant,9.75,Master,deloitte,university of virginia,0
430,1.0,Mental Health Care,nanny,3.68,Master,grow australia,wurzweiler school of social work,0
500,2.0,Design,designer,12.34,Master,landor fitch,fashion institute of technology,0
500,4.0,Medical Practice,physician,4.84,Master,weill cornell medicine,università cattolica del sacro cuore,0
457,1.0,Photography,teaching,7.0,Master,international center of photography,biomimicry 3 8,0
500,1.0,Design,professor,9.91,Master,parsons school for design,parsons school of design,0
500,6.0,IT Services and IT Consulting,strategic,19.0,MBA,santech solution inc,indian institute of management lucknow,0
500,1.0,Human Resources Services,human resources,16.42,empty,televisaunivision,william howard taft high school,0
500,2.0,Non-profit Organization Management,market research analyst,8.75,MBA,golconda partners,baruch college,0
500,6.0,Financial Services,investments,23.0,MBA,citigroup,st john s university,0
500,3.0,Computer & Network Security,lifeguard,18.09,Master,unisys,texas woman s university,0
500,6.0,Financial Services,brand marketing,18.83,MBA,new york life insurance company,university of connecticut,0
500,1.0,International Affairs,social,9.08,Master,un women,new york university,0
500,6.0,Beverage Manufacturing,marketing consultant,2.58,MBA,bacardi,uc berkeley,0
500,5.0,Financial Services,financial analysis,9.25,Master,citi,university of rochester simon business school,0
500,5.0,Computer Software,social,9.84,empty,wbaf usa country office,university of connecticut school of business,0
500,4.0,Financial Services,engineering,25.33,MBA,two sigma,columbia business school,0
500,6.0,Financial Services,data scientist,13.58,Master,mastercard,indian institute of technology kanpur,0
500,4.0,Accounting,financial reporting,8.92,MBA,hellofresh,dominican college of blauvelt,0
500,4.0,Research,systems architect,10.92,Master,openai,university at buffalo,0
387,5.0,Advertising Services,marketing sales,15.49,Master,evija mehra business,fashion institute of technology,0
386,3.0,Public Relations and Communications Services,promotions,16.58,Master,sesame workshop,baruch college,0
500,4.0,Music,digital,6.4,Master,mezz entertainment,new york university,0
500,6.0,Computer Software,product design,23.0,empty,walmart,jefferson state community college,0
500,2.0,Manufacturing,market,27.16,MBA,allied beverage group,fordham university,0
500,4.0,Information Technology & Services,it project,24.68,MBA,citi,rochester institute of technology,0
500,2.0,Public Relations and Communications Services,social media,7.91,Master,burson marsteller,syracuse university,0
389,2.0,Investment Management,quantitative analyst,8.92,Master,bayview asset management llc,peking university,0
500,5.0,Entertainment,writer,21.48,empty,brownsville bred,wynn handman studios,0
500,7.0,Medical Device,business finance,29.25,MBA,lifescan,northwestern university kellogg school of management,0
500,3.0,Computer Software,knowledge,23.33,empty,bill melinda gates foundation,university of pennsylvania,0
500,7.0,Hospital & Health Care,marketing officer,32.59,MBA,virtua health,fairleigh dickinson university,0
500,4.0,Staffing and Recruiting,sales,3.92,empty,actus consulting group inc,temple university,0
500,5.0,Hospital & Health Care,professor,9.33,Master,new york university,columbia university mailman school of public health,0
500,2.0,Online Media,community,24.16,High School,people magazine people com,fordham university,0
500,5.0,Financial Services,public relations,12.0,Master,idb bank,new york university,0
500,3.0,Public Relations & Communications,ambassador,7.24,Master,laforce,university of kentucky,0
500,3.0,Real Estate,realtor,1.0,Master,the pam christian group,columbia university in the city of new york,0
500,5.0,Business Consulting and Services,consulting,13.0,Master,deepak lalwani associates llc,columbia university,0
500,4.0,Architecture and Planning,designer,10.75,Master,neri hu design and research office,harvard university graduate school of design,0
500,5.0,Non-profit Organization Management,admissions,17.17,Master,alliance of families for justice,john jay college cuny,0
500,6.0,Capital Markets,investment,11.16,Master,moody s analytics,bentley university,0
500,4.0,Financial Services,portfolio,5.67,Master,goldman sachs,lehigh university,0
500,5.0,Financial Services,human resources,12.0,empty,citi,stony brook university,0
500,6.0,Hospital & Health Care,physician,16.42,empty,northwell health,johns hopkins bloomberg school of public health,0
500,4.0,Financial Services,marketing consultant,20.24,empty,nasdaq,carleton university,0
375,2.0,Primary/Secondary Education,substitute teacher,8.42,Master,south bronx preparatory a college board school,richard gilder graduate school at the american museum of natural history,0
500,2.0,Higher Education,teacher,14.0,Master,new brunswick public schools,rowan university,0
377,2.0,Design,graphic design,10.92,Master,amplify,cmu human computer interaction institute,0
500,5.0,Writing and Editing,editor,16.16,Master,the new york times licensing group,american university school of international service,0
500,5.0,Financial Services,wholesaler,22.08,empty,pico,sungard platinum leadership program,0
500,2.0,IT Services and IT Consulting,research development engineer,11.5,Master,camp systems international inc,penn state university,0
500,5.0,Apparel & Fashion,editor,12.17,High School,nüvoices,donghua university,0
462,1.0,Apparel & Fashion,student,3.57,Master,ucl,ucl,0
500,4.0,Online Media,social media,27.49,Master,livestream universe publishing,new york university,0
