numconnections,seniority,currentindustry,mapped_role,total_experience_years,highest_degree,company_cleaned,campus_cleaned,cluster_id
500,5.0,Commercial Real Estate,investments,22.41,Master,bones investment group,university of tennessee knoxville,0
500,3.0,Hospitals and Health Care,telemarketing,3.09,MBA,axletree solutions,california state university east bay,0
500,3.0,Oil & Energy,research engineer,15.84,Master,self employed,boston university,0
401,2.0,Sports,event coordinator,10.0,Master,wollman rink nyc,nyu school of professional studies,0
500,4.0,Retail Apparel and Fashion,social media,17.49,Master,kcd,florida state university,0
500,2.0,Spectator Sports,public affairs,9.91,Master,united nations,king s college london,0
500,4.0,Telecommunications,creative,27.08,Master,consiglieri,university of central florida,0
401,1.0,Research,clinical research,11.08,Master,new jersey medical reserve corps,st xavier s college university of mumbai,0
420,2.0,Hospitality,cook,17.92,Associate,madison square garden entertainment corp,the culinary institute of america,0
445,5.0,Public Relations and Communications Services,media relations,13.33,Master,hunter,new york university,0
385,4.0,Research Services,scientist,12.07,Master,merck,polytechnic institute of new york university,0
500,5.0,Biotechnology,business strategy,11.08,Master,zoomrx,indian institute of management calcutta,0
500,4.0,Consumer Services,real estate broker,10.17,MBA,usl capital,palm beach atlantic university,0
500,1.0,Non-profit Organization Management,teaching,17.91,Master,copay inc community organization for parents and youth,hofstra university,0
500,5.0,Information Technology & Services,consulting,24.08,Master,infosys,stanford university graduate school of business,0
500,2.0,Financial Services,quantitative analyst,8.58,Master,capula investment management llp,mit sloan school of management,0
458,3.0,Media Production,producer,8.68,empty,viacom,connecticut college,0
395,1.0,Mining,supply chain coordinator,15.67,Master,berlin packaging,lycee des glieres annemasse france,0
500,2.0,Higher Education,book seller,7.16,MBA,shiseido,rutgers university,0
500,5.0,Financial Services,investment analyst,12.5,MBA,boston consulting group bcg,nyu stern school of business,0
500,3.0,Marketing & Advertising,digital marketing,18.99,empty,dr kirchner consulting,columbia university,0
500,4.0,Business Consulting and Services,project consultant,7.75,Master,deloitte,university of nottingham,0
433,1.0,Law Practice,teacher,3.67,empty,rutgers university new brunswick,bordentown regional high school,0
500,5.0,Photography,video editor,11.43,Master,spectrum news,cuny graduate school of journalism,0
500,2.0,Banking,database administrator,2.67,Master,citi,america bangladesh university,0
500,1.0,Architecture & Planning,professor,12.01,Master,seoul national university of science and technology,harvard university graduate school of design,0
500,4.0,Human Resources,talent,9.08,Master,spencer stuart,columbia university,0
500,6.0,Software Development,ios developer,10.91,Master,grist labs,harvard university,0
500,6.0,Management Consulting,strategist,28.0,MBA,tertulia,columbia university,0
500,6.0,Design Services,ux ui designer,17.67,Master,partnerise,new york university,0
500,4.0,Fundraising,ambassador,19.67,Master,united hatzalah of israel,jewish theological seminary of america,0
500,3.0,Hospitality,sales administrator,19.33,Associate,breads bakery,mercer county community college,0
500,6.0,Information Technology & Services,talent development,26.0,Master,huron,american university,0
500,6.0,Mental Health Care,ambassador,40.25,MBA,awaken joy,southern connecticut state university,0
500,6.0,IT Services and IT Consulting,systems architect,42.41,empty,various,brown university,0
500,4.0,Marketing & Advertising,marketing,3.74,Master,at t,new york university,0
500,3.0,Computer Software,software engineering,8.58,Master,ibm,georgia institute of technology,0
500,1.0,Government Administration,substitute teacher,14.01,Master,vital strategies,suny geneseo,0
500,4.0,Professional Training & Coaching,ambassador,42.75,MBA,innovation women,montclair state university,0
500,2.0,Media Production,artist,8.59,Master,de productions,yale university,0
373,1.0,Publishing,writer,3.33,Master,penguin random house,pace university,0
500,5.0,Information Technology & Services,software architect,11.41,Master,ibm,university of new haven,0
500,6.0,Advertising Services,marketing analyst,37.09,MBA,mars,lehigh university,0
500,5.0,Broadcast Media Production and Distribution,sales analyst,10.5,empty,westwood one,providence college,0
500,7.0,Financial Services,strategy business development,17.41,MBA,brigit,columbia business school,0
500,3.0,Marketing & Advertising,social media marketing,22.64,empty,tiktok,s i newhouse school of public communications at syracuse university,0
500,2.0,Non-profit Organization Management,network administrator,16.58,Associate,veg er for pets,universidad manuela beltrán,0
500,6.0,Online Audio and Video Media,creative,20.84,Master,united nations,school of the art institute of chicago,0
500,5.0,Computer Software,strategy consultant,9.16,MBA,uber,the wharton school,0
500,6.0,Advertising Services,media relations,7.16,Master,ddb,the george washington university,0
500,5.0,International Trade and Development,social,24.01,Master,every mother counts,harvard university graduate school of education,0
500,2.0,Oil & Energy,bartender,16.33,MBA,bp,manhattan college,0
500,6.0,Financial Services,research analyst,23.16,Master,aca group,the george washington university,0
500,1.0,Book and Periodical Publishing,reporter,17.0,Master,various publications,columbia university graduate school of journalism,0
475,4.0,Computer & Network Security,counselor,11.08,Master,sumitomo mitsui banking corporation,the city college of new york,0
500,6.0,Consumer Services,marketing coordinator,15.99,empty,ground up international,brooklyn technical high school,0
500,7.0,Advertising Services,creative,37.33,empty,code and theory,aish hatorah,0
500,6.0,Software Development,strategist,21.91,MBA,wingmen ventures,northwestern university kellogg school of management,0
500,5.0,Mental Health Care,teacher,20.97,Master,talkspace,tufts university school of medicine,0
500,5.0,Information Technology & Services,ambassador,2.17,Master,arbolus,university of glasgow,0
500,6.0,Computer Software,data architect,21.5,Master,microsoft,university of pune k k wagh coe,0
500,2.0,Financial Services,promoter,9.5,empty,commcise,hobart and william smith colleges,0
500,1.0,Primary/Secondary Education,teacher,15.4,Master,bold charter school,hunter college,0
500,4.0,Newspapers,journalist,10.41,Master,amazon,columbia university in the city of new york,0
500,5.0,Utilities,researcher,6.25,Master,energy and environmental economics inc,eth zürich,0
500,2.0,Online Audio and Video Media,content creator,6.91,Master,bronx film 48,manhattan college,0
465,2.0,Accounting,tax preparer,9.25,Master,schonfeld,baruch college,0
500,5.0,Financial Services,financial analysis,7.92,Master,kenvue,rutgers business school,0
500,1.0,Primary/Secondary Education,teacher,5.08,Master,heritage middle school,teachers college columbia university,0
500,6.0,Oil and Gas,sales business development,34.75,MBA,catalyst strategic advisors,albertus magnus college,0
500,3.0,Computer Software,product,15.75,empty,deloitte digital,baruch college,0
500,1.0,Writing & Editing,teacher,15.72,Master,manhattanville university,manhattanville university,0
500,1.0,Financial Services,research analyst,1.33,Master,the bank of east asia limited bea,nyu tandon school of engineering,0
500,2.0,Architecture & Planning,teaching,9.83,Master,cuny new york city college of technology,university of michigan,0
426,1.0,"Health, Wellness & Fitness",event,13.57,Master,glow recipe,the george washington university,0
500,5.0,Environmental Services,writer,23.0,Master,grec sud,columbia university in the city of new york,0
500,3.0,International Trade & Development,social,4.33,Master,action against hunger usa,the london school of economics and political science lse,0
500,6.0,Pharmaceutical Manufacturing,medical,26.42,empty,emblem corp toronto,bishop s university,0
500,6.0,Non-profit Organization Management,research,8.24,MBA,givedirectly,yale school of management,0
500,3.0,E-learning,business analyst,2.34,Master,kneoworld inc,bentley university,0
500,4.0,Graphic Design,designer,9.41,Master,oxman,harvard university graduate school of design,0
500,5.0,International Affairs,social,24.67,MBA,united nations,university of south carolina the moore school of business,0
500,5.0,Entertainment Providers,professor,51.32,MBA,financial times,columbia business school,0
446,2.0,Music,teacher,16.84,Master,young new yorkers chorus,belmont university,0
497,3.0,Industrial Machinery Manufacturing,software engineering,13.24,Master,siro,cornell university graduate school,0
500,3.0,"Technology, Information and Internet",software developer,19.25,empty,yahoo,chubb institute,0
500,3.0,Banking,compliance analyst,8.92,Master,td,queens college of the city university of new york,0
500,5.0,Online Media,content,22.09,Master,ey,university of king s college,0
500,5.0,Advertising Services,marketing project,10.91,MBA,capital one,massachusetts institute of technology sloan school of management,0
500,6.0,Hospital & Health Care,emergency medical technician,7.32,MBA,unitedhealth group,cornell university,0
500,2.0,Public Relations & Communications,host,1.76,Master,gaffney bennett pr,syracuse university martin j whitman school of management,0
500,1.0,Government Administration,promotions,19.74,MBA,nava health,university of bridgeport,0
500,4.0,Commercial Real Estate,real estate,21.58,MBA,newmark,university of new haven,0
500,5.0,Financial Services,investment,45.49,MBA,one creation corporation,cornell university,0
500,3.0,Non-profit Organization Management,event coordinator,27.92,Master,jumpstart,new york university,0
500,6.0,Financial Services,audit,20.75,empty,kpmg us,association of chartered certified accountants,0
500,4.0,International Affairs,journalist,8.93,Master,the resource foundation trf,columbia university,0
500,6.0,Real Estate,project development,10.66,Master,drucker munoz architecture,columbia university,0
440,4.0,Human Resources,data analytics,13.33,Master,pwc,saint joseph s university,0
387,1.0,Publishing,editor,12.48,Master,qobuz,university of virginia,0
500,5.0,Environmental Services,professor,34.67,Master,the city university of new york,georgia regents university,0
500,5.0,Civic and Social Organizations,public relations,18.24,Master,clinton foundation,university of southern california,0
500,5.0,IT Services and IT Consulting,software engineering,15.58,High School,goldbelly,universidad nacional del sur,0
500,7.0,Education Administration Programs,education,22.67,Master,mission 44,harvard graduate school of education,0
500,6.0,Banking,capital markets,10.34,MBA,ey,harvard university,0
500,2.0,Design,ux ui designer,6.33,Master,intuit mailchimp,nyu tandon school of engineering,0
500,1.0,Museums & Institutions,writer,5.06,Master,the museum of modern art,pratt institute,0
500,2.0,Government Administration,equity research,2.0,Master,state administration of foreign exchange,columbia university in the city of new york,0
500,4.0,Marketing & Advertising,creative,8.99,Master,l oréal,fashion institute of technology,0
500,6.0,Architecture and Planning,construction project,36.59,Master,new york city police department,new york university polytechnic school of engineering,0
431,1.0,Broadcast Media,content creator,7.17,Master,wwe,columbia university graduate school of journalism,0
400,2.0,Government Administration,social,13.66,Master,center for science in the public interest,columbia university mailman school of public health,0
500,6.0,Photography,art,5.33,Master,queenie cao jewelry,school of visual arts,0
500,5.0,Marketing & Advertising,strategist,9.41,Master,21grams,university of alabama at birmingham,0
500,7.0,Information Technology & Services,technology officer,17.76,Master,aterian nasdaq ater,bar ilan university,0
500,4.0,Hospital & Health Care,call center representative,24.83,Master,magnacare,stony brook southampton,0
500,3.0,Medical Practices,physician,12.5,empty,atlantic health system,icahn school of medicine at mount sinai,0
500,2.0,Financial Services,business intelligence analyst,2.66,Master,fordham gabelli school of business,fordham gabelli school of business,0
500,5.0,Government Administration,project finance,10.33,Master,mace,the city college of new york,0
500,3.0,Computer Software,artist,4.0,Master,freelance skema business school polimi graduate school of management,polimi graduate school of management,0
426,3.0,Non-Profit Organization Management,teaching,19.58,Master,citizens campaign for the environment,yale school of the environment,0
500,5.0,Professional Training & Coaching,coach,21.5,High School,super soccer stars,south trafford college,0
500,2.0,Banking,economist,4.83,MBA,barclays investment bank,the tuck school of business at dartmouth,0
500,6.0,Financial Services,investment banking analyst,8.25,MBA,stealth,harvard business school,0
500,6.0,Computer Software,financial analyst,18.0,MBA,kyndryl,quinnipiac university,0
500,6.0,Architecture & Planning,directors,7.33,Master,hill and valley properties llc,parsons school of design the new school,0
500,4.0,IT Services and IT Consulting,strategy consultant,8.51,MBA,mckinsey company,columbia business school,0
500,7.0,Computer Software,reservoir engineer,11.91,Master,nesh,the university of texas at austin,0
457,1.0,Primary/Secondary Education,teacher,21.81,Master,wagner prep,indiana university bloomington,0
500,5.0,Professional Training & Coaching,strategist,15.33,MBA,bellwether with jim frawley,columbia university columbia business school,0
500,5.0,Banking,portfolio,19.41,empty,anz,university of technology sydney,0
500,4.0,E-learning,research development engineer,8.67,empty,360learning,ecole centrale paris,0
500,6.0,Insurance,negotiator,27.0,MBA,chubb formerly ace group,fachhochschule kiel,0
500,6.0,Financial Services,capital markets,13.16,MBA,guggenheim partners,boston college carroll school of management,0
464,3.0,Civil Engineering,engineer,3.92,Master,thornton tomasetti,rensselaer polytechnic institute,0
500,1.0,Writing and Editing,writer,23.91,Master,freelance,new school for social research,0
346,3.0,Information Technology & Services,software programmer,4.75,Master,dell technologies,pace university seidenberg school of computer science and information systems,0
500,3.0,Banking,investment banking analyst,4.42,Master,apollo global management inc,università bocconi,0
500,1.0,Advertising Services,content,7.33,Master,freelance writer,the new school,0
500,3.0,Media Production,producer,19.74,empty,stephen david entertainment,montana state university bozeman,0
500,5.0,Legal Services,law,7.5,empty,sbi the growth advisory,seton hall university school of law,0
500,2.0,Religious Institutions,admissions,17.4,Master,congregation rodeph sholom,baruch college,0
500,3.0,Marketing & Advertising,account,10.25,empty,vistar media,university of florida,0
500,6.0,Venture Capital & Private Equity,strategic,12.42,MBA,anywhere real estate inc,yale school of management,0
500,3.0,Computer Software,video editor,17.65,Master,warner bros discovery,university of washington,0
500,5.0,Sports,social media,16.43,empty,national basketball association nba,marquette university,0
500,3.0,Information Technology & Services,computer technician,20.57,empty,livcor a blackstone company,technical career institute,0
500,5.0,Investment Banking,researcher,32.58,MBA,fidelity investments,st john s university,0
500,7.0,Insurance,financial officer,37.17,MBA,aon,the wharton school,0
500,1.0,Marketing & Advertising,education,23.0,Master,guttenberg school district,the college of new jersey,0
383,2.0,Writing and Editing,writer,11.58,Master,self employed,queens college,0
500,4.0,Financial Services,business sales,25.25,empty,extensishr,bloomfield high school,0
500,6.0,Financial Services,capital markets,30.5,MBA,boston consulting group bcg,melbourne business school,0
500,2.0,Newspaper Publishing,editor,18.91,Master,cbs news,syracuse university,0
500,6.0,Financial Services,directors,45.34,MBA,cmr institute customizable life sciences training virginia u s a,columbia business school,0
500,1.0,Religious Institutions,social worker,5.66,Master,nissan borr lmft llc,rabbinical seminary of america,0
500,5.0,Media Production,editor,6.01,Master,marquette wire,columbia university,0
500,5.0,Real Estate,development,1.92,Master,equinox,the university of connecticut school of business,0
417,1.0,Civic & Social Organization,social,6.82,Master,the new york foundling,fordham graduate school of social service,0
500,4.0,IT Services and IT Consulting,business intelligence consultant,8.75,Master,ey,university at buffalo school of management the state university of new york,0
500,2.0,Law Practice,law,12.49,empty,36 stone chambers commercial barristers set london and singapore,harvard law school,0
500,4.0,Hospitality,chef,2.0,empty,barbuto restaurant,university of mississippi,0
500,3.0,Hospital & Health Care,social,9.16,Master,weill cornell medicine,new york university,0
500,3.0,Government Administration,campaign,5.92,Master,apple fundraising consultants,the london school of economics and political science lse,0
500,3.0,Law Practice,law,15.33,Master,paul weiss rifkind wharton garrison llp,duke university school of law,0
500,6.0,Hospitality,food beverage,22.58,Master,sage hospitality group,new york university,0
446,5.0,Public Policy Offices,social,16.82,Master,manatt phelps phillips llp,the george washington university milken institute school of public health,0
500,7.0,Information Technology & Services,software architect,22.5,MBA,finsi,quantic school of business and technology,0
500,5.0,Advertising Services,editor,15.5,empty,gainor staffing,the new school,0
500,6.0,Financial Services,mergers acquisitions,30.33,Master,accenture,drexel university,0
489,3.0,Pharmaceuticals,treasury,18.42,MBA,novartis,university of michigan stephen m ross school of business,0
500,6.0,Photography,public relations,7.0,Master,world jewish congress,fairleigh dickinson university,0
500,4.0,Marketing & Advertising,promotions,8.76,empty,culthealth an indegene company,ithaca college,0
500,5.0,Investment Banking,equity,11.34,MBA,axis axis capital,nyu stern school of business,0
500,2.0,Information Technology & Services,software developer,4.83,Master,adp,binghamton university,0
451,3.0,Broadcast Media Production and Distribution,producer,16.83,Master,abc news,columbia university graduate school of journalism,0
500,3.0,Information Technology & Services,strategic marketing,19.01,MBA,google,columbia business school,0
500,4.0,Investment Banking,investment,20.99,MBA,aevolve technologies,rutgers graduate business school,0
341,6.0,Pharmaceuticals,marketing representative,32.08,MBA,d e arberg investments,iona college,0
384,1.0,Higher Education,support,14.98,Master,ramapo for children,columbia university,0
500,2.0,Banking,researcher,11.75,Master,essec business school,the fletcher school at tufts university,0
500,3.0,Investment Management,portfolio analyst,16.0,Master,s p global,northeastern university,0
500,5.0,Education Administration Programs,teacher,28.33,Master,touro university,relay graduate school of education,0
453,5.0,Media Production,communications coordinator,21.0,empty,blue butterfly collaborative,iona college,0
451,3.0,Insurance,insurance agent,28.92,empty,generazio associates inc,livingston high school,0
500,1.0,Performing Arts,artist,29.83,Master,new york university abu dhabi,the city college of new york,0
500,7.0,Advertising Services,marketing communications,19.93,MBA,itrek,nyu stern school of business,0
500,7.0,Religious Institutions,reporter,32.82,Master,interfaith alliance,union theological seminary,0
500,6.0,Business Consulting and Services,strategic,14.83,MBA,the neurodivergent parent collective,university of michigan stephen m ross school of business,0
500,2.0,"Health, Wellness & Fitness",nanny,9.16,Master,university hospitals,simmons university,0
500,6.0,Market Research,analytics,19.41,Master,logic and zeal,baruch college,0
500,7.0,Information Technology & Services,strategy business development,32.92,MBA,jupiter intelligence,the wharton school,0
500,6.0,Business Consulting and Services,strategic,23.34,MBA,kaufman hall,indian institute of management ahmedabad,0
500,4.0,Food Production,substitute teacher,6.84,Master,j j snack foods corp,rutgers university new brunswick,0
500,7.0,Real Estate,business developer,9.75,MBA,the everset,zicklin school of business,0
500,3.0,Higher Education,writer,6.66,empty,penguin random house,harvard university,0
500,6.0,Education Administration Programs,innovation,29.17,Master,amazon,university of cambridge teaching house,0
500,7.0,Internet,software engineering,8.17,MBA,thoropass,harvard business school,0
500,4.0,Investment Banking,equity,9.07,MBA,jefferies,indiana university bloomington,0
500,4.0,Financial Services,quantitative analyst,6.34,empty,goldman sachs,princeton university,0
384,4.0,Environmental Services,directors,0.92,Master,booz allen hamilton,syracuse university maxwell school,0
500,3.0,Information Technology & Services,spring,21.49,Master,amazon,franklin marshall college,0
500,5.0,Professional Training & Coaching,professor,7.91,Master,new york university,nyu stern school of business,0
500,6.0,Leasing Non-residential Real Estate,public relations,22.09,Master,lument,columbia university graduate school of journalism,0
500,5.0,IT Services and IT Consulting,software architect,19.75,Master,dnb,university of technology sydney,0
500,2.0,Information Technology & Services,system analyst,18.08,MBA,otsuka pharmaceutical companies u s,rider university,0
500,7.0,Financial Services,marketing business development,22.67,MBA,citizens,rice business,0
347,4.0,Information Services,professor,41.5,Master,cuny new york city college of technology,the graduate center city university of new york,0
500,2.0,Computer Software,creative,20.58,Master,designlab,parsons school of design the new school,0
500,5.0,Food & Beverages,key account sales,23.59,MBA,nestlé,long island university,0
500,2.0,Software Development,software engineer,5.41,Master,meta,the university of texas at austin,0
500,5.0,Retail Art Supplies,artist,31.0,Master,sepiaeye,new york university,0
500,3.0,Government Administration,ambassador,6.17,Master,the permanent observer mission of the african union to the united nations,university of chester,0
500,2.0,Performing Arts,producer,22.58,empty,deadly deslusions movie for lifetime,anthony abeson nyc,0
500,6.0,Real Estate,capital markets,8.74,empty,em investment partners emip,columbia university,0
500,2.0,Museums & Institutions,teaching,11.41,Master,christie s,new york university,0
398,3.0,Human Resources,compensation,26.67,MBA,freelance,pace university lubin school of business,0
500,1.0,Design Services,creative,30.25,empty,the sweet shop nyc,fashion institute of technology,0
480,4.0,Government Administration,professor,35.66,MBA,yale school of architecture,new york university,0
500,1.0,"Health, Wellness & Fitness",teacher,34.14,Master,kensington wellness,teachers college columbia university,0
500,4.0,Financial Services,leasing consultant,5.25,Master,con edison,cornell university,0
500,5.0,IT Services and IT Consulting,strategist,10.51,Master,gaingels,columbia university,0
500,4.0,Computer Software,writer,13.09,Master,self employed,google creative campus,0
500,4.0,Management Consulting,consulting,4.92,MBA,kepler cannon,columbia business school,0
500,2.0,Venture Capital & Private Equity,spring,6.17,MBA,unigestion,columbia business school,0
500,5.0,Pharmaceutical Manufacturing,market access,17.01,empty,sandoz,indian institute of management calcutta,0
500,5.0,Retail Luxury Goods and Jewelry,design consultant,10.09,MBA,almar sales,art institute of phoenix,0
500,5.0,Music,producer,9.0,Master,reliance brands limited,boston university college of communication,0
500,3.0,Financial Services,portfolio analyst,9.0,Master,clear street,carnegie mellon university,0
500,5.0,Financial Services,non,27.16,MBA,ey,fordham gabelli school of business,0
500,5.0,Medical Device,sales representative,31.67,empty,urolift system by teleflex interventional urology,dutchess community college,0
396,4.0,Writing & Editing,editor,18.59,Master,penguin random house,san francisco state university,0
500,5.0,Retail Apparel and Fashion,visual merchandising,21.08,empty,saint laurent,esmod international,0
500,5.0,Environmental Services,public affairs,15.74,Master,grassroots global justice,yale school of the environment,0
500,6.0,Logistics & Supply Chain,supply,13.33,empty,senator construction group inc,fashion institute of technology,0
500,2.0,Computer Software,public relations,13.58,Master,cnn,rhode island school of design,0
500,2.0,Electrical & Electronic Manufacturing,technical sales representative,13.17,empty,franklin electric,watertown high school,0
500,6.0,Financial Services,admissions,14.07,MBA,morgan stanley,quinnipiac university,0
500,2.0,Mental Health Care,project coordinator,9.0,Master,sk p brand,mspp,0
500,3.0,Software Development,machine engineer,11.75,Master,anthropic,ucl,0
500,5.0,Education Administration Programs,counselor,26.75,MBA,guild hall,harvard university,0
500,5.0,Hospitality,resident,31.25,Associate,flik hospitality group,westchester community college,0
500,2.0,Aviation and Aerospace Component Manufacturing,hardware engineer,20.0,empty,telephonics,hofstra university,0
500,3.0,Professional Training & Coaching,business development consultant,15.16,empty,a f financial,briarcliff college,0
500,2.0,Telecommunications,software engineer,14.33,Master,crown castle,university of alabama in huntsville,0
500,6.0,Entertainment,producer,19.57,Master,taking over,université sorbonne nouvelle,0
435,1.0,Defense & Space,research engineer,5.42,Master,the aerospace corporation,university of michigan,0
