numconnections,seniority,currentindustry,mapped_role,total_experience_years,highest_degree,company_cleaned,campus_cleaned,cluster_id
230,6.0,Investment Management,capital markets,19.67,Bachelor,clearbridge investments,baruch college,2
251,2.0,Higher Education,administrator,6.58,Master,john jay college cuny,long island university brooklyn campus,2
168,2.0,Marketing & Advertising,marketing,6.34,Associate,axis promotions,university of carlow ireland,2
330,3.0,Apparel & Fashion,social media marketing,6.99,Bachelor,models com,parsons school of design the new school,2
217,2.0,Real Estate,claims adjuster,18.76,Bachelor,metro public adjustment inc,nyu,2
305,2.0,Hospitals and Health Care,software designer,12.67,Doctor,google,duke university,2
153,5.0,Information Technology & Services,python developer,12.08,Bachelor,verizon,government college of technology coimbatore,2
196,2.0,Public Relations & Communications,writer,1.25,MBA,adecco,south college,2
276,2.0,Medical Practices,teaching,0.92,Doctor,icahn school of medicine at mount sinai,tel aviv university,2
194,3.0,Medical Device,regulatory affairs,16.41,Doctor,teleflex,stony brook university,2
257,4.0,Higher Education,professor,13.17,Doctor,rutgers university,princeton university,2
311,4.0,Utilities,systems consultant,36.59,Bachelor,ppl corporation,lehigh university college of business and economics,2
199,1.0,Research,research,23.92,Master,columbia business school,columbia business school,2
331,1.0,Medical Practice,counselor,22.0,Master,portrait health centers lifestance health inc,monmouth university,2
152,1.0,Writing & Editing,book seller,16.99,Master,woodbury public library,texas woman s university,2
184,2.0,Education Management,education,13.49,Bachelor,the office of the executive vice president for arts and sciences at columbia university,school of visual arts,2
270,2.0,Museums & Institutions,real estate broker,16.16,Master,prevu,sotheby s institute of art,2
197,2.0,Accounting,tax accountant,0.83,Master,morgan stanley,fordham gabelli school of business,2
352,4.0,Telecommunications,analyst,18.42,Bachelor,verizon,centenary college,2
195,1.0,Publishing,editor,16.0,Bachelor,scholastic,pace university,2
310,1.0,Animation,production artist,1.5,empty,pratt institute,pratt institute,2
199,2.0,Financial Services,investment analyst,3.08,Master,ubs,massachusetts institute of technology,2
163,1.0,Entertainment Providers,content creator,19.07,Bachelor,school of rock,berklee college of music,2
354,3.0,Financial Services,investment,10.09,empty,wells fargo,university of south carolina darla moore school of business,2
290,5.0,Legal Services,strategic account,16.5,Bachelor,ravel law a lexisnexis company,indiana university bloomington,2
305,4.0,Pharmaceuticals,statistical programmer,4.33,empty,bristol myers squibb,columbia university mailman school of public health,2
271,1.0,Architecture and Planning,architecture,3.33,Master,design collective inc,university of maryland college park,2
403,2.0,Entertainment Providers,treasurer,10.92,Bachelor,jefferies,pace university lubin school of business,2
156,1.0,Financial Services,client service representative,10.17,empty,calamos investments,dominican university new york,2
222,2.0,Financial Services,trust,45.83,MBA,wealth advisory group llc,new york university leonard n stern school of business,2
281,5.0,Architecture & Planning,architect,15.25,Bachelor,spiezle architectural group inc,new jersey institute of technology,2
281,3.0,"Health, Wellness & Fitness",teacher,8.0,Bachelor,claudia colombo skin wellness,institute for integrative nutrition,2
254,2.0,Marketing & Advertising,social media marketing,1.0,Bachelor,msc mediterranean shipping company,hobart and william smith colleges,2
369,5.0,Research Services,research scientist,10.25,Doctor,johnson johnson,university of maryland baltimore,2
195,6.0,Architecture and Planning,architect,10.41,Bachelor,pei partnership architects,yale university school of architecture,2
327,1.0,Primary/Secondary Education,teacher,17.91,Master,newark public schools,relay graduate school of education,2
160,2.0,Public Policy,professor,12.92,Doctor,weill cornell medicine,weill cornell graduate school of medical sciences,2
214,1.0,Primary/Secondary Education,substitute teacher,19.33,Master,briarcliff manor union free school district,lehman college,2
269,5.0,Financial Services,portfolio,18.58,Bachelor,the citco group limited,baruch college city university of new york cuny,2
324,4.0,Facilities Services,business services,6.49,Bachelor,family owned appliance repair and retail business,baruch college,2
223,3.0,Logistics & Supply Chain,customer service,12.25,Bachelor,bet mgm,west virginia university,2
240,6.0,Accounting,tax consultant,13.34,Bachelor,nksfb,state university of new york at plattsburgh,2
381,5.0,Higher Education,substitute teacher,5.75,Doctor,columbia university in the city of new york,london school of hygiene and tropical medicine u of london,2
212,2.0,Research,financial analyst,10.34,Associate,population council,stamford college,2
296,2.0,Computer Software,research scientist,15.67,Doctor,schrödinger,princeton university,2
278,5.0,Primary and Secondary Education,teaching,23.84,Master,mamaroneck union free school district,hunter college,2
359,4.0,Non-profit Organization Management,graphic design,13.42,Bachelor,united way,university of mary washington,2
367,5.0,Real Estate,realtor,8.75,empty,coldwell banker,villanova university,2
332,1.0,Higher Education,teaching,14.07,Doctor,washington state university,washington state university,2
248,5.0,Law Practice,directors,1.0,Doctor,force for good super pac,the george washington university law school,2
160,2.0,Mechanical Or Industrial Engineering,mechanical engineer,11.5,Bachelor,astrodyne tdi,new jersey institute of technology,2
314,5.0,Financial Services,lending,15.33,Bachelor,bank of america merrill lynch,borough of manhattan community college,2
296,4.0,Marketing & Advertising,social media,8.67,Bachelor,fat earth media,suny new paltz,2
292,1.0,Photography,photographer,5.92,Bachelor,milk,the cooper union for the advancement of science and art,2
301,2.0,Oil & Energy,manufacturing,8.83,Master,koehler instrument company inc,stony brook university,2
335,1.0,Computer Software,research,3.25,Doctor,university of guelph,university of guelph,2
249,2.0,Mechanical Or Industrial Engineering,manufacturing,7.67,Master,nassau candy distributors inc,georgia institute of technology,2
163,2.0,Computer Software,software engineering,3.99,Master,amazon,university of southern california,2
205,4.0,Mental Health Care,nurse,25.34,Doctor,weill cornell medicine,new york university,2
317,2.0,Entertainment Providers,actor,42.17,Bachelor,actor singer filmmaker union member,florida state university,2
222,4.0,Libraries,community,15.42,Bachelor,self employed,monmouth university,2
206,4.0,Public Relations & Communications,ambassador,8.33,Associate,anycasting china,montclair state university,2
178,1.0,Pharmaceuticals,microbiologist,4.33,Bachelor,topix pharmaceuticals inc,stony brook university,2
324,4.0,Chemicals,small business,6.67,Bachelor,jajaja plantas mexicana,university of arizona,2
292,1.0,Transportation/Trucking/Railroad,leasing consultant,17.0,Bachelor,stitch this print that,towson university,2
152,3.0,Financial Services,investment consultant,4.75,Bachelor,morgan stanley,mount holyoke college,2
377,2.0,Construction,project development,22.42,empty,lgr builders inc,florida atlantic university,2
351,2.0,Internet,software engineering,5.5,Doctor,google,columbia university,2
356,3.0,Construction,projectmanager,7.0,Bachelor,transmatch realty advisors b v,schoevers college,2
165,1.0,Aviation & Aerospace,crew,8.76,empty,flexjet,western suffolk boces,2
184,3.0,Writing & Editing,writer,10.24,empty,byline,lunds universitet,2
152,3.0,Biotechnology,physician,14.0,Doctor,penn state health,new york institute of technology college of osteopathic medicine,2
258,1.0,IT Services and IT Consulting,web designer,10.58,empty,local wisdom,general assembly,2
350,3.0,Hospital & Health Care,substitute teacher,5.42,Doctor,icahn school of medicine at mount sinai,mcmaster university,2
206,2.0,Marketing & Advertising,accountant,7.25,Bachelor,psyop,hunter college,2
298,4.0,Public Relations and Communications Services,communications,13.5,Master,new york city center,brooklyn college,2
361,5.0,Higher Education,professor,6.91,Master,nyu grossman school of medicine,the graduate center city university of new york,2
160,4.0,Semiconductors,customer success,16.33,Associate,vayyar imaging,gurnick academy of medical arts,2
263,1.0,Hospitals and Health Care,rn,12.76,Bachelor,all american healthcare services inc,university of phoenix,2
235,1.0,Education Administration Programs,substitute teacher,20.33,Master,memorial sloan kettering cancer center,sarah lawrence college,2
230,3.0,Law Practice,law,5.16,Doctor,cole schotz p c,elisabeth haub school of law at pace university,2
238,2.0,Accounting,tax accountant,6.57,Master,andersen,zicklin school of business,2
227,1.0,Law Practice,law,2.08,Bachelor,lassar cowhey llp,oxford college of emory university,2
203,2.0,Writing and Editing,writer,9.25,Master,borough of manhattan community college,rutgers university,2
262,3.0,Non-profit Organizations,teaching,11.5,Doctor,weill cornell medicine,joan sanford i weill medical college of cornell university,2
226,4.0,Architecture and Planning,architect,11.24,Master,nyu tandon school of engineering,harvard university graduate school of design,2
235,1.0,Photography,promoter,0.42,Bachelor,vector marketing,hofstra university,2
241,2.0,Photography,art,6.42,Bachelor,freelance,parsons school of design,2
249,2.0,Advertising Services,search,4.0,MBA,mediacom,loyola university chicago,2
312,1.0,Entertainment Providers,style,2.25,Master,kiko make up milano,make up designory,2
181,1.0,IT Services and IT Consulting,accounts payable,11.59,Bachelor,apex systems,colorado technical university colorado springs colorado december,2
337,1.0,Performing Arts,student worker,19.33,Master,new york university tisch school of the arts,new york university,2
200,5.0,Banking,credit analyst,24.16,empty,loose ends,yale university,2
401,2.0,Oil & Energy,qc inspector,28.08,empty,mechanical integrity inspection and consulting llc,qai training for quality llc,2
273,2.0,Law Practice,case,17.49,Doctor,lutheran social services of new york,city university of new york school of law,2
240,3.0,Computer Software,research,19.33,Doctor,meta,harvard university,2
167,4.0,Retail Apparel and Fashion,design consultant,8.08,Bachelor,me too shoes,parsons school of design the new school,2
362,5.0,IT Services and IT Consulting,data engineer,15.5,Bachelor,amazon,vellore institute of technology,2
207,2.0,Music,artist,5.5,Master,las americas en concierto,ithaca college,2
240,1.0,Design Services,store,10.0,Bachelor,mood home,university of massachusetts amherst,2
305,5.0,Beverage Manufacturing,food beverage,15.01,Bachelor,commis,california state university chico,2
203,1.0,Media Production,social media,6.24,Bachelor,studio of america,boston university,2
202,1.0,Performing Arts,production coordinator,18.5,Bachelor,the sheen center for thought and culture,king s college,2
263,5.0,Computer Software,technical writer,16.17,Bachelor,tibco,farmingdale state college,2
315,1.0,Medical Practice,teaching,0.08,Doctor,nyc health hospitals,st george s university,2
235,3.0,Hospital & Health Care,nursing,14.58,Bachelor,new york presbyterian hospital,dr carlos lanting college,2
320,3.0,Software Development,software engineering,8.66,Master,ihealthscreen inc,new york university,2
263,1.0,Primary/Secondary Education,teaching,6.59,Master,the river school,new york university,2
171,5.0,Publishing,editor,26.09,Bachelor,educational publishing firm,nyu,2
336,7.0,Real Estate,directors,8.83,Associate,cammarata real estate group,weichert real estate school,2
300,1.0,Primary/Secondary Education,teacher,5.41,Master,the windward school,manhattanville college school of professional studies,2
350,3.0,Research,scientific,11.33,Doctor,kramer levin naftalis frankel llp,weill cornell graduate school of medical sciences,2
298,1.0,Broadcast Media Production and Distribution,journalist,16.24,Bachelor,nbcuniversal media llc,william paterson university of new jersey,2
305,3.0,Marketing & Advertising,media relations,3.34,Master,wpp media,trinity college dublin,2
174,2.0,Government Administration,law,7.58,Doctor,nyc administration for children s services,new york law school,2
335,2.0,Legal Services,law,10.83,Bachelor,clark smith villazor llp,john jay college cuny,2
349,5.0,Architecture and Planning,architect,13.5,Master,man group,city university of new york brooklyn college,2
312,5.0,Chemicals,manufacturing operations,27.85,MBA,deccan heritage foundation india,mba uk,2
240,1.0,Government Administration,research,0.41,Bachelor,new york state assembly,baruch college,2
154,2.0,Insurance,database developer,14.0,empty,whatsuppbox,drexel university,2
332,2.0,Research Services,economist,16.17,Master,u s department of the treasury,university of the philippines,2
170,4.0,Utilities,engineering,9.16,MBA,con edison,nyu stern school of business,2
279,5.0,Fundraising,development,10.0,Master,american associates of the royal academy trust,ben gurion university of the negev,2
210,1.0,Public Policy Offices,community relations,5.17,Bachelor,columbia university irving medical center,city university of new york hunter college,2
173,5.0,"Health, Wellness & Fitness",clinical,3.58,Bachelor,nola physical therapy performance,new york medical college,2
321,2.0,Financial Services,business analyst,2.42,Bachelor,arga investment management lp,university of michigan,2
191,1.0,Investment Banking,audit,29.16,Associate,pricewaterhousecoopers ll,american institute of banking,2
231,5.0,Online Audio and Video Media,brand marketing,25.84,Bachelor,golf com and golf magazine,cornell university,2
262,4.0,Pharmaceuticals,clinical research,22.5,empty,sanofi,rutgers university college of pharmacy,2
391,1.0,Cosmetics,makeup artist,19.0,empty,ford artists nyc at ford models,pace university,2
156,2.0,Primary and Secondary Education,education,9.09,Master,central islip union free school district 13,touro college,2
279,5.0,Religious Institutions,food beverage,22.6,Associate,advanta health solutions inc,art institute of philadelphia,2
189,2.0,Industrial Machinery Manufacturing,design engineering,23.25,Master,stantec consulting services,new york university polytechnic school of engineering,2
341,2.0,Airlines/Aviation,embedded software engineer,4.92,Master,pratt whitney,case western reserve university,2
340,1.0,Mental Health Care,coach,25.57,Master,f45 training,john jay college cuny,2
295,2.0,Higher Education,professor,2.92,Doctor,shenzhen university,georgia state university,2
258,2.0,Telecommunications,writer,8.67,Master,n a,new york university,2
338,1.0,Legal Services,law,6.16,Bachelor,united states attorneys offices,northeastern university,2
351,2.0,Financial Services,coach,32.0,MBA,self employed,columbia business school,2
161,4.0,Food and Beverage Services,catering,23.09,empty,9 bar consulting llc,specialty coffee association,2
151,1.0,Retail Apparel and Fashion,design consultant,9.25,Bachelor,major label group,fashion institute of technology,2
302,3.0,Hospital & Health Care,physician,14.17,Doctor,montefiore health system,umass chan medical school,2
241,4.0,Higher Education,teaching,9.75,Doctor,touro university,teachers college columbia university,2
169,3.0,Hospital & Health Care,medical,8.83,Master,ventureblick,new york university,2
284,1.0,Higher Education,substitute teacher,18.06,Bachelor,curtis high school,american museum of natural history education department,2
232,2.0,Law Practice,law,11.16,Bachelor,fenwick west,harvard law school,2
192,5.0,Human Resources,human resources,18.42,Master,edelta consulting,baruch college,2
267,6.0,Law Practice,attorney,25.92,Doctor,smith gambrell russell llp,stanford law school,2
188,3.0,Financial Services,writer,22.0,MBA,bradley woods co,iolani school honolulu hi,2
163,3.0,Hospitality,creative,11.17,Bachelor,encore boston harbor,westfield state university,2
189,1.0,Entertainment Providers,teacher,15.25,Bachelor,harlem link charter school ps 208,new york university,2
243,4.0,Hospital & Health Care,nurse,4.41,Master,xu z chen psychiatrist pllc,nyu rory meyers college of nursing,2
196,1.0,Law Enforcement,security officer,4.0,empty,somerset county sheriff s office,morris county k 9 academy nj,2
174,2.0,Investment Banking,equity research analyst,3.17,Master,contra aquam capital,tulane university a b freeman school of business,2
183,2.0,Medical Practices,physical therapist,8.49,Doctor,agile physical therapy inc,columbia university college of physicians and surgeons,2
151,2.0,Hospital & Health Care,clinical,7.39,Master,tribeca preparatory,new york university,2
173,6.0,Real Estate,equity research,9.0,Master,everstrong asset management,columbia university in the city of new york,2
188,2.0,Media Production,video editor,7.67,Bachelor,aerodef manufacturing,college for creative studies,2
171,4.0,Defense & Space,development engineer,21.59,Master,lgs innovations caci,university of madras,2
219,2.0,Higher Education,teacher,24.58,Doctor,barnard college,laban bartenieff institute of movement studies lims,2
213,4.0,Research Services,professor,11.59,Doctor,nyu grossman school of medicine,university of toronto,2
300,6.0,Information Technology & Services,business development consultant,2.34,Bachelor,crf,brookdale community college,2
245,2.0,Motion Pictures & Film,social media,3.26,Bachelor,hbo,the university of tulsa,2
277,1.0,Fine Art,editor,4.92,Doctor,princeton university art museum,princeton university,2
237,5.0,Legal Services,professor,12.17,Doctor,john jay college cuny,new york law school,2
168,3.0,Hospital & Health Care,research scientist,7.5,Doctor,columbia university irving medical center,virginia tech,2
360,1.0,Architecture & Planning,architecture,9.33,Bachelor,csa group architects and engineers,university of arkansas,2
213,4.0,Government Administration,counselor,25.16,Bachelor,nyc department for the aging,monroe college,2
282,1.0,Information Technology & Services,helpdesk,7.17,Master,united nations,keller graduate school of management of devry university,2
169,2.0,Higher Education,research,14.15,Doctor,mississippi state university,hackensack meridian school of medicine,2
290,3.0,"Transportation, Logistics, Supply Chain and Storage",software engineering,8.5,Master,google,georgia institute of technology,2
240,1.0,Research,research,16.16,Bachelor,yale translational brain imaging program,yale university,2
188,7.0,Information Technology & Services,marketing officer,58.0,empty,ihearvoices ai l3c,cu,2
387,4.0,Research,teaching,16.5,Bachelor,michigan medicine,columbia university vagelos college of physicians and surgeons,2
304,5.0,Accounting,consulting,10.33,Bachelor,pwc,monash university,2
202,2.0,Renewables & Environment,research analyst,5.25,Doctor,institute for policy integrity at nyu school of law,university of rhode island,2
302,2.0,Financial Services,portfolio analyst,7.33,Bachelor,morgan stanley,universidade presbiteriana mackenzie,2
295,6.0,Photography,press,36.33,Bachelor,philipstown north highlands fire district,oberlin college oh,2
319,2.0,Architecture and Planning,designer,13.75,Master,brailsford dunlavey inc,george mason university school of business,2
380,1.0,Museums & Institutions,writer,10.91,Master,little brown and company,amherst college,2
262,5.0,Information Technology & Services,strategy analyst,13.58,MBA,american express,nyu stern school of business,2
155,2.0,Hospital & Health Care,research technician,2.5,Bachelor,pfizer,seton hall university,2
180,2.0,Hospitals and Health Care,clinical,20.83,Master,life hive nutrition,new york university,2
317,3.0,Biotechnology Research,process analyst,18.92,Master,kft,new jersey institute of technology,2
221,3.0,Computer Software,software engineering,6.42,Bachelor,opensea,carnegie mellon university,2
292,5.0,Higher Education,research,10.5,Doctor,cuny urban food policy institute,hunter college,2
290,4.0,Apparel & Fashion,product,8.92,Master,tura inc,parsons school of design the new school,2
237,4.0,Education Administration Programs,teacher,37.91,Master,logitech,new york institute of technology old westbury,2
262,1.0,Professional Training and Coaching,digital media,5.33,Bachelor,smarties candy,university of san francisco,2
170,5.0,Retail Apparel and Fashion,sales business development,10.0,empty,chantelle lingerie inc,california state university fullerton,2
172,2.0,Graphic Design,graphic design,3.83,Bachelor,macmillan,the college of saint rose,2
174,1.0,Legal Services,law,7.58,Doctor,catholic charities of the archdiocese of new york,city university of new york school of law,2
294,7.0,Architecture & Planning,designer,3.0,Bachelor,design with frank,the cooper union for the advancement of science and art,2
161,2.0,Wholesale Building Materials,design engineering,11.0,Bachelor,jcryanebco,universidad albert einstein,2
166,4.0,Research,professor,10.5,Doctor,lehman college,brown university,2
306,5.0,Individual and Family Services,case,22.09,empty,career break,hofstra university,2
259,5.0,Artists and Writers,writer,21.41,Master,the wildenstein plattner institute,syracuse university,2
337,5.0,Design Services,design,28.51,Master,ik design,savannah college of art and design,2
233,3.0,Financial Services,financial analyst,8.08,High School,nfp,boston university,2
224,2.0,Government Administration,law,3.92,Bachelor,u s department of labor,simmons university,2
298,2.0,Computer Software,software engineering,2.84,Bachelor,dun bradstreet,flatiron school,2
396,3.0,Accounting,tax accountant,13.49,Bachelor,pacific life,brooklyn college,2
294,5.0,Financial Services,quantitative analyst,60.08,Bachelor,retired from goldman sachs as a vice president senior engineer for 28 years,baruch college,2
203,4.0,Law Practice,law,20.99,Doctor,new york city taxi and limousine commission,cardozo school of law,2
324,2.0,Mental Health Care,research,17.83,Doctor,the mount sinai hospital,university of pennsylvania school of medicine,2
167,4.0,Research Services,social,13.34,Master,new york city housing authority nycha,pratt institute,2
394,2.0,Hospital & Health Care,nurse,4.26,Bachelor,flushing hospital,molloy university,2
193,2.0,"Transportation, Logistics, Supply Chain and Storage",inspector,19.33,empty,cox company,centre security training school,2
151,2.0,Hospital & Health Care,physician,10.67,Bachelor,memorial sloan kettering cancer center,the royal college of physicians london,2
152,2.0,Mechanical Or Industrial Engineering,mechanical design engineer,3.17,Bachelor,nanotronics,new york university,2
225,6.0,Law Practice,research scientist,9.25,Doctor,fish richardson p c,fordham university school of law,2
186,5.0,Philanthropic Fundraising Services,directors,20.33,Doctor,nowhereville,western new england college school of law,2
288,3.0,Software Development,student,3.0,Master,city university of new york brooklyn college,brooklyn college,2
271,3.0,Higher Education,teacher,19.74,Master,sora schools,bard college,2
162,1.0,Musicians,actor,16.0,Master,music arts,the city university of new york,2
228,2.0,Internet,research engineer,12.92,Doctor,meta,the university of texas at austin,2
179,4.0,Primary/Secondary Education,software engineering,25.66,Doctor,the virtual forge,lehigh university,2
299,6.0,Advertising Services,marketing representative,7.0,empty,constant media,college of the holy cross,2
268,1.0,Research,research,5.24,empty,vanderbilt university,vanderbilt university,2
234,3.0,Hospital & Health Care,professor,17.92,Doctor,columbia university irving medical center,icahn school of medicine at mount sinai,2
320,5.0,Retail,press,10.93,Bachelor,theory,hunter college,2
187,5.0,Marketing & Advertising,writer,15.01,Master,raptive,sarah lawrence college,2
221,2.0,International Affairs,law,13.24,Master,united nations,international institute of humanitarian law,2
211,5.0,Financial Services,economist,1.59,Master,rbc capital markets,johns hopkins school of advanced international studies sais,2
361,3.0,"Health, Wellness & Fitness",administrative support,19.6,Doctor,new york eye and ear infirmary of mount sinai,fordham university school of law,2
156,2.0,Research,teaching,10.42,Master,new york university,new york university,2
337,1.0,Graphic Design,designer,1.83,Bachelor,pacific,the new school,2
218,1.0,Real Estate,real estate agent,25.67,Bachelor,nest seekers international,성균관대학교 sungkyunkwan university,2
250,3.0,IT Services and IT Consulting,software engineer,10.41,empty,zinnia,the george washington university,2
314,5.0,Financial Services,strategy analyst,5.84,MBA,citi,texas a m university corpus christi,2
251,1.0,Higher Education,crew,9.58,Doctor,azza s garden,purdue university,2
158,3.0,Pharmaceutical Manufacturing,research scientist,5.0,Doctor,columbia university in the city of new york,university of florida,2
160,3.0,Higher Education,teacher,7.66,Doctor,hofstra university,st john s university,2
152,1.0,Information Technology & Services,crew,4.58,Master,hazen and sawyer,columbia engineering,2
368,2.0,Hospital & Health Care,cna,6.67,Bachelor,cooperman barnabas medical center,fairleigh dickinson university,2
234,2.0,Research,research,5.83,Doctor,psi paul scherrer institut,eth zürich,2
269,1.0,Accounting,audit,7.57,MBA,deloitte,pace university lubin school of business,2
356,2.0,Research,research,16.16,Doctor,open health scientific communications,rutgers university newark,2
181,6.0,Government Administration,teacher,5.41,Master,organ donation awareness corporation,columbia university mailman school of public health,2
318,3.0,Retail,design,13.16,empty,hop lun,the ohio state university,2
190,1.0,Education Management,admissions,10.99,Bachelor,success academy charter schools,new york university,2
154,4.0,Professional Training & Coaching,stage,6.75,Bachelor,dale carnegie training,the citadel,2
242,3.0,Hospital & Health Care,software designer,7.25,Bachelor,ready computing,flatiron school,2
